include/master-slave.inc
Warnings:
Note	####	Sending passwords in plain text without SSL/TLS is extremely insecure.
Note	####	Storing MySQL user name or password information in the master info repository is not secure and is therefore not recommended. Please consider using the USER and PASSWORD connection options for START SLAVE; see the 'START SLAVE Syntax' in the MySQL Manual for more information.
[connection master]
use test;
create table t( col varchar(200) default 'xpchild',
col1 int,
col2 char(100),
col3 varchar(100),
key ind(col),
key ind_1(col1),
key ind_2(col2),
key ind_3(col3))engine=innodb row_format=comfort;
insert into t(col, col1, col2, col3)  values('xp1', 2, 'xp', 'xpchild');
insert into t(col, col1, col2, col3)  values('xp2', 2, 'xp', 'xpchild');
commit;
insert into t(col1, col2, col3) select col1, col2, col3 from t;
insert into t(col1, col2, col3) select col1, col2, col3 from t;
insert into t(col1, col2, col3) select col1, col2, col3 from t;
insert into t(col1, col2, col3) select col1, col2, col3 from t;
insert into t(col1, col2, col3) select col1, col2, col3 from t;
insert into t(col1, col2, col3) select col1, col2, col3 from t;
insert into t(col1, col2, col3) select col1, col2, col3 from t;
insert into t(col1, col2, col3) select col1, col2, col3 from t;
select count(*) from t;
count(*)
512
checksum table t;
Table	Checksum
test.t	3894233197
alter table t add col4 varchar(1000);
select col4 from t limit 10;
col4
NULL
NULL
NULL
NULL
NULL
NULL
NULL
NULL
NULL
NULL
checksum table t;
Table	Checksum
test.t	3894233197
update t set col4=concat(col3, col1);
commit;
select col4 from t limit 10;
col4
xpchild2
xpchild2
xpchild2
xpchild2
xpchild2
xpchild2
xpchild2
xpchild2
xpchild2
xpchild2
checksum table t;
Table	Checksum
test.t	3956600308
###########################################
delete and insert same record
###########################################
delete from t where col='xp1';
insert into t values('xp1', 2, 'xp', 'xpchild', 'xp');
commit;
select * from t where col='xp1';
col	col1	col2	col3	col4
xp1	2	xp	xpchild	xp
###########################################
create index on added column
###########################################
create index t_ind_4 on t(col4);
Warnings:
Warning	1071	Specified key was too long; max key length is 767 bytes
select * from t where col4='xp';
col	col1	col2	col3	col4
xp1	2	xp	xpchild	xp
###########################################
alter table add more than one column
###########################################
alter table t add col5 int, add col6 int;
select * from t where col='xp1';
col	col1	col2	col3	col4	col5	col6
xp1	2	xp	xpchild	xp	NULL	NULL
###########################################
alter table add clob column
###########################################
alter table t add col7 text;
select * from t where col='xp1';
col	col1	col2	col3	col4	col5	col6	col7
xp1	2	xp	xpchild	xp	NULL	NULL	NULL
update t set col7=repeat('xpchild', 10000) where col='xp1';
Warnings:
Warning	1265	Data truncated for column 'col7' at row 1
commit;
select * from t where col='xp1' or col ='xp2';
col	col1	col2	col3	col4	col5	col6	col7
xp2	2	xp	xpchild	xpchild2	NULL	NULL	NULL
xp1	2	xp	xpchild	xp	NULL	NULL	xpchildxpchildxpchildxpchildxpchildxpchildxpchildxpchildxpchildxpchildxpchildxpchildxpchildxpchildxpchildxpchildxpchildxpchildxpchildxpchildxpchildxpchildxpchildxpchildxpchildxpchildxpchildxpchildxpchildxpchildxpchildxpchildxpchildxpchildxpchildxpchildxpchildxpchildxpchildxpchildxpchildxpchildxpchildxpchildxpchildxpchildxpchildxpchildxpchildxpchildxpchildxpchildxpchildxpchildxpchildxpchildxpchildxpchildxpchildxpchildxpchildxpchildxpchildxpchildxpchildxpchildxpchildxpchildxpchildxpchildxpchildxpchildxpchildxpchildxpchildxpchildxpchildxpchildxpchildxpchildxpchildxpchildxpchildxpchildxpchildxpchildxpchildxpchildxpchildxpchildxpchildxpchildxpchildxpchildxpchildxpchildxpchildxpchildxpchildxpchildxpchildxpchildxpchildxpchildxpchildxpchildxpchildxpchildxpchildxpchildxpchildxpchildxpchildxpchildxpchildxpchildxpchildxpchildxpchildxpchildxpchildxpchildxpchildxpchildxpchildxpchildxpchildxpchildxpchildxpchildxpchildxpchildxpchildxpchildxpchildxpchildxpchildxpchildxpchildxpchildxpchildxpchildxpchildxpchildxpchildxpchildxpchildxpchildxpchildxpchildxpchildxpchildxpchildxpchildxpchildxpchildxpchildxpchildxpchildxpchildxpchildxpchildxpchildxpchildxpchildxpchildxpchildxpchildxpchildxpchildxpchildxpchildxpchildxpchildxpchildxpchildxpchildxpchildxpchildxpchildxpchildxpchildxpchildxpchildxpchildxpchildxpchildxpchildxpchildxpchildxpchildxpchildxpchildxpchildxpchildxpchildxpchildxpchildxpchildxpchildxpchildxpchildxpchildxpchildxpchildxpchildxpchildxpchildxpchildxpchildxpchildxpchildxpchildxpchildxpchildxpchildxpchildxpchildxpchildxpchildxpchildxpchildxpchildxpchildxpchildxpchildxpchildxpchildxpchildxpchildxpchildxpchildxpchildxpchildxpchildxpchildxpchildxpchildxpchildxpchildxpchildxpchildxpchildxpchildxpchildxpchildxpchildxpchildxpchildxpchildxpchildxpchildxpchildxpchildxpchildxpchildxpchildxpchildxpchildxpchildxpchildxpchildxpchildxpchildxpchildxpchildxpchildxpchildxpchildxpchildxpchildxpchildxpchildxpchildxpchildxpchildxpchildxpchildxpchildxpchildxpchildxpchildxpchildxpchildxpchildxpchildxpchildxpchildxpchildxpchildxpchildxpchildxpchildxpchildxpchildxpchildxpchildxpchildxpchildxpchildxpchildxpchildxpchildxpchildxpchildxpchildxpchildxpchildxpchildxpchildxpchildxpchildxpchildxpchildxpchildxpchildxpchildxpchildxpchildxpchildxpchildxpchildxpchildxpchildxpchildxpchildxpchildxpchildxpchildxpchildxpchildxpchildxpchildxpchildxpchildxpchildxpchildxpchildxpchildxpchildxpchildxpchildxpchildxpchildxpchildxpchildxpchildxpchildxpchildxpchildxpchildxpchildxpchildxpchildxpchildxpchildxpchildxpchildxpchildxpchildxpchildxpchildxpchildxpchildxpchildxpchildxpchildxpchildxpchildxpchildxpchildxpchildxpchildxpchildxpchildxpchildxpchildxpchildxpchildxpchildxpchildxpchildxpchildxpchildxpchildxpchildxpchildxpchildxpchildxpchildxpchildxpchildxpchildxpchildxpchildxpchildxpchildxpchildxpchildxpchildxpchildxpchildxpchildxpchildxpchildxpchildxpchildxpchildxpchildxpchildxpchildxpchildxpchildxpchildxpchildxpchildxpchildxpchildxpchildxpchildxpchildxpchildxpchildxpchildxpchildxpchildxpchildxpchildxpchildxpchildxpchildxpchildxpchildxpchildxpchildxpchildxpchildxpchildxpchildxpchildxpchildxpchildxpchildxpchildxpchildxpchildxpchildxpchildxpchildxpchildxpchildxpchildxpchildxpchildxpchildxpchildxpchildxpchildxpchildxpchildxpchildxpchildxpchildxpchildxpchildxpchildxpchildxpchildxpchildxpchildxpchildxpchildxpchildxpchildxpchildxpchildxpchildxpchildxpchildxpchildxpchildxpchildxpchildxpchildxpchildxpchildxpchildxpchildxpchildxpchildxpchildxpchildxpchildxpchildxpchildxpchildxpchildxpchildxpchildxpchildxpchildxpchildxpchildxpchildxpchildxpchildxpchildxpchildxpchildxpchildxpchildxpchildxpchildxpchildxpchildxpchildxpchildxpchildxpchildxpchildxpchildxpchildxpchildxpchildxpchildxpchildxpchildxpchildxpchildxpchildxpchildxpchildxpchildxpchildxpchildxpchildxpchildxpchildxpchildxpchildxpchildxpchildxpchildxpchildxpchildxpchildxpchildxpchildxpchildxpchildxpchildxpchildxpchildxpchildxpchildxpchildxpchildxpchildxpchildxpchildxpchildxpchildxpchildxpchildxpchildxpchildxpchildxpchildxpchildxpchildxpchildxpchildxpchildxpchildxpchildxpchildxpchildxpchildxpchildxpchildxpchildxpchildxpchildxpchildxpchildxpchildxpchildxpchildxpchildxpchildxpchildxpchildxpchildxpchildxpchildxpchildxpchildxpchildxpchildxpchildxpchildxpchildxpchildxpchildxpchildxpchildxpchildxpchildxpchildxpchildxpchildxpchildxpchildxpchildxpchildxpchildxpchildxpchildxpchildxpchildxpchildxpchildxpchildxpchildxpchildxpchildxpchildxpchildxpchildxpchildxpchildxpchildxpchildxpchildxpchildxpchildxpchildxpchildxpchildxpchildxpchildxpchildxpchildxpchildxpchildxpchildxpchildxpchildxpchildxpchildxpchildxpchildxpchildxpchildxpchildxpchildxpchildxpchildxpchildxpchildxpchildxpchildxpchildxpchildxpchildxpchildxpchildxpchildxpchildxpchildxpchildxpchildxpchildxpchildxpchildxpchildxpchildxpchildxpchildxpchildxpchildxpchildxpchildxpchildxpchildxpchildxpchildxpchildxpchildxpchildxpchildxpchildxpchildxpchildxpchildxpchildxpchildxpchildxpchildxpchildxpchildxpchildxpchildxpchildxpchildxpchildxpchildxpchildxpchildxpchildxpchildxpchildxpchildxpchildxpchildxpchildxpchildxpchildxpchildxpchildxpchildxpchildxpchildxpchildxpchildxpchildxpchildxpchildxpchildxpchildxpchildxpchildxpchildxpchildxpchildxpchildxpchildxpchildxpchildxpchildxpchildxpchildxpchildxpchildxpchildxpchildxpchildxpchildxpchildxpchildxpchildxpchildxpchildxpchildxpchildxpchildxpchildxpchildxpchildxpchildxpchildxpchildxpchildxpchildxpchildxpchildxpchildxpchildxpchildxpchildxpchildxpchildxpchildxpchildxpchildxpchildxpchildxpchildxpchildxpchildxpchildxpchildxpchildxpchildxpchildxpchildxpchildxpchildxpchildxpchildxpchildxpchildxpchildxpchildxpchildxpchildxpchildxpchildxpchildxpchildxpchildxpchildxpchildxpchildxpchildxpchildxpchildxpchildxpchildxpchildxpchildxpchildxpchildxpchildxpchildxpchildxpchildxpchildxpchildxpchildxpchildxpchildxpchildxpchildxpchildxpchildxpchildxpchildxpchildxpchildxpchildxpchildxpchildxpchildxpchildxpchildxpchildxpchildxpchildxpchildxpchildxpchildxpchildxpchildxpchildxpchildxpchildxpchildxpchildxpchildxpchildxpchildxpchildxpchildxpchildxpchildxpchildxpchildxpchildxpchildxpchildxpchildxpchildxpchildxpchildxpchildxpchildxpchildxpchildxpchildxpchildxpchildxpchildxpchildxpchildxpchildxpchildxpchildxpchildxpchildxpchildxpchildxpchildxpchildxpchildxpchildxpchildxpchildxpchildxpchildxpchildxpchildxpchildxpchildxpchildxpchildxpchildxpchildxpchildxpchildxpchildxpchildxpchildxpchildxpchildxpchildxpchildxpchildxpchildxpchildxpchildxpchildxpchildxpchildxpchildxpchildxpchildxpchildxpchildxpchildxpchildxpchildxpchildxpchildxpchildxpchildxpchildxpchildxpchildxpchildxpchildxpchildxpchildxpchildxpchildxpchildxpchildxpchildxpchildxpchildxpchildxpchildxpchildxpchildxpchildxpchildxpchildxpchildxpchildxpchildxpchildxpchildxpchildxpchildxpchildxpchildxpchildxpchildxpchildxpchildxpchildxpchildxpchildxpchildxpchildxpchildxpchildxpchildxpchildxpchildxpchildxpchildxpchildxpchildxpchildxpchildxpchildxpchildxpchildxpchildxpchildxpchildxpchildxpchildxpchildxpchildxpchildxpchildxpchildxpchildxpchildxpchildxpchildxpchildxpchildxpchildxpchildxpchildxpchildxpchildxpchildxpchildxpchildxpchildxpchildxpchildxpchildxpchildxpchildxpchildxpchildxpchildxpchildxpchildxpchildxpchildxpchildxpchildxpchildxpchildxpchildxpchildxpchildxpchildxpchildxpchildxpchildxpchildxpchildxpchildxpchildxpchildxpchildxpchildxpchildxpchildxpchildxpchildxpchildxpchildxpchildxpchildxpchildxpchildxpchildxpchildxpchildxpchildxpchildxpchildxpchildxpchildxpchildxpchildxpchildxpchildxpchildxpchildxpchildxpchildxpchildxpchildxpchildxpchildxpchildxpchildxpchildxpchildxpchildxpchildxpchildxpchildxpchildxpchildxpchildxpchildxpchildxpchildxpchildxpchildxpchildxpchildxpchildxpchildxpchildxpchildxpchildxpchildxpchildxpchildxpchildxpchildxpchildxpchildxpchildxpchildxpchildxpchildxpchildxpchildxpchildxpchildxpchildxpchildxpchildxpchildxpchildxpchildxpchildxpchildxpchildxpchildxpchildxpchildxpchildxpchildxpchildxpchildxpchildxpchildxpchildxpchildxpchildxpchildxpchildxpchildxpchildxpchildxpchildxpchildxpchildxpchildxpchildxpchildxpchildxpchildxpchildxpchildxpchildxpchildxpchildxpchildxpchildxpchildxpchildxpchildxpchildxpchildxpchildxpchildxpchildxpchildxpchildxpchildxpchildxpchildxpchildxpchildxpchildxpchildxpchildxpchildxpchildxpchildxpchildxpchildxpchildxpchildxpchildxpchildxpchildxpchildxpchildxpchildxpchildxpchildxpchildxpchildxpchildxpchildxpchildxpchildxpchildxpchildxpchildxpchildxpchildxpchildxpchildxpchildxpchildxpchildxpchildxpchildxpchildxpchildxpchildxpchildxpchildxpchildxpchildxpchildxpchildxpchildxpchildxpchildxpchildxpchildxpchildxpchildxpchildxpchildxpchildxpchildxpchildxpchildxpchildxpchildxpchildxpchildxpchildxpchildxpchildxpchildxpchildxpchildxpchildxpchildxpchildxpchildxpchildxpchildxpchildxpchildxpchildxpchildxpchildxpchildxpchildxpchildxpchildxpchildxpchildxpchildxpchildxpchildxpchildxpchildxpchildxpchildxpchildxpchildxpchildxpchildxpchildxpchildxpchildxpchildxpchildxpchildxpchildxpchildxpchildxpchildxpchildxpchildxpchildxpchildxpchildxpchildxpchildxpchildxpchildxpchildxpchildxpchildxpchildxpchildxpchildxpchildxpchildxpchildxpchildxpchildxpchildxpchildxpchildxpchildxpchildxpchildxpchildxpchildxpchildxpchildxpchildxpchildxpchildxpchildxpchildxpchildxpchildxpchildxpchildxpchildxpchildxpchildxpchildxpchildxpchildxpchildxpchildxpchildxpchildxpchildxpchildxpchildxpchildxpchildxpchildxpchildxpchildxpchildxpchildxpchildxpchildxpchildxpchildxpchildxpchildxpchildxpchildxpchildxpchildxpchildxpchildxpchildxpchildxpchildxpchildxpchildxpchildxpchildxpchildxpchildxpchildxpchildxpchildxpchildxpchildxpchildxpchildxpchildxpchildxpchildxpchildxpchildxpchildxpchildxpchildxpchildxpchildxpchildxpchildxpchildxpchildxpchildxpchildxpchildxpchildxpchildxpchildxpchildxpchildxpchildxpchildxpchildxpchildxpchildxpchildxpchildxpchildxpchildxpchildxpchildxpchildxpchildxpchildxpchildxpchildxpchildxpchildxpchildxpchildxpchildxpchildxpchildxpchildxpchildxpchildxpchildxpchildxpchildxpchildxpchildxpchildxpchildxpchildxpchildxpchildxpchildxpchildxpchildxpchildxpchildxpchildxpchildxpchildxpchildxpchildxpchildxpchildxpchildxpchildxpchildxpchildxpchildxpchildxpchildxpchildxpchildxpchildxpchildxpchildxpchildxpchildxpchildxpchildxpchildxpchildxpchildxpchildxpchildxpchildxpchildxpchildxpchildxpchildxpchildxpchildxpchildxpchildxpchildxpchildxpchildxpchildxpchildxpchildxpchildxpchildxpchildxpchildxpchildxpchildxpchildxpchildxpchildxpchildxpchildxpchildxpchildxpchildxpchildxpchildxpchildxpchildxpchildxpchildxpchildxpchildxpchildxpchildxpchildxpchildxpchildxpchildxpchildxpchildxpchildxpchildxpchildxpchildxpchildxpchildxpchildxpchildxpchildxpchildxpchildxpchildxpchildxpchildxpchildxpchildxpchildxpchildxpchildxpchildxpchildxpchildxpchildxpchildxpchildxpchildxpchildxpchildxpchildxpchildxpchildxpchildxpchildxpchildxpchildxpchildxpchildxpchildxpchildxpchildxpchildxpchildxpchildxpchildxpchildxpchildxpchildxpchildxpchildxpchildxpchildxpchildxpchildxpchildxpchildxpchildxpchildxpchildxpchildxpchildxpchildxpchildxpchildxpchildxpchildxpchildxpchildxpchildxpchildxpchildxpchildxpchildxpchildxpchildxpchildxpchildxpchildxpchildxpchildxpchildxpchildxpchildxpchildxpchildxpchildxpchildxpchildxpchildxpchildxpchildxpchildxpchildxpchildxpchildxpchildxpchildxpchildxpchildxpchildxpchildxpchildxpchildxpchildxpchildxpchildxpchildxpchildxpchildxpchildxpchildxpchildxpchildxpchildxpchildxpchildxpchildxpchildxpchildxpchildxpchildxpchildxpchildxpchildxpchildxpchildxpchildxpchildxpchildxpchildxpchildxpchildxpchildxpchildxpchildxpchildxpchildxpchildxpchildxpchildxpchildxpchildxpchildxpchildxpchildxpchildxpchildxpchildxpchildxpchildxpchildxpchildxpchildxpchildxpchildxpchildxpchildxpchildxpchildxpchildxpchildxpchildxpchildxpchildxpchildxpchildxpchildxpchildxpchildxpchildxpchildxpchildxpchildxpchildxpchildxpchildxpchildxpchildxpchildxpchildxpchildxpchildxpchildxpchildxpchildxpchildxpchildxpchildxpchildxpchildxpchildxpchildxpchildxpchildxpchildxpchildxpchildxpchildxpchildxpchildxpchildxpchildxpchildxpchildxpchildxpchildxpchildxpchildxpchildxpchildxpchildxpchildxpchildxpchildxpchildxpchildxpchildxpchildxpchildxpchildxpchildxpchildxpchildxpchildxpchildxpchildxpchildxpchildxpchildxpchildxpchildxpchildxpchildxpchildxpchildxpchildxpchildxpchildxpchildxpchildxpchildxpchildxpchildxpchildxpchildxpchildxpchildxpchildxpchildxpchildxpchildxpchildxpchildxpchildxpchildxpchildxpchildxpchildxpchildxpchildxpchildxpchildxpchildxpchildxpchildxpchildxpchildxpchildxpchildxpchildxpchildxpchildxpchildxpchildxpchildxpchildxpchildxpchildxpchildxpchildxpchildxpchildxpchildxpchildxpchildxpchildxpchildxpchildxpchildxpchildxpchildxpchildxpchildxpchildxpchildxpchildxpchildxpchildxpchildxpchildxpchildxpchildxpchildxpchildxpchildxpchildxpchildxpchildxpchildxpchildxpchildxpchildxpchildxpchildxpchildxpchildxpchildxpchildxpchildxpchildxpchildxpchildxpchildxpchildxpchildxpchildxpchildxpchildxpchildxpchildxpchildxpchildxpchildxpchildxpchildxpchildxpchildxpchildxpchildxpchildxpchildxpchildxpchildxpchildxpchildxpchildxpchildxpchildxpchildxpchildxpchildxpchildxpchildxpchildxpchildxpchildxpchildxpchildxpchildxpchildxpchildxpchildxpchildxpchildxpchildxpchildxpchildxpchildxpchildxpchildxpchildxpchildxpchildxpchildxpchildxpchildxpchildxpchildxpchildxpchildxpchildxpchildxpchildxpchildxpchildxpchildxpchildxpchildxpchildxpchildxpchildxpchildxpchildxpchildxpchildxpchildxpchildxpchildxpchildxpchildxpchildxpchildxpchildxpchildxpchildxpchildxpchildxpchildxpchildxpchildxpchildxpchildxpchildxpchildxpchildxpchildxpchildxpchildxpchildxpchildxpchildxpchildxpchildxpchildxpchildxpchildxpchildxpchildxpchildxpchildxpchildxpchildxpchildxpchildxpchildxpchildxpchildxpchildxpchildxpchildxpchildxpchildxpchildxpchildxpchildxpchildxpchildxpchildxpchildxpchildxpchildxpchildxpchildxpchildxpchildxpchildxpchildxpchildxpchildxpchildxpchildxpchildxpchildxpchildxpchildxpchildxpchildxpchildxpchildxpchildxpchildxpchildxpchildxpchildxpchildxpchildxpchildxpchildxpchildxpchildxpchildxpchildxpchildxpchildxpchildxpchildxpchildxpchildxpchildxpchildxpchildxpchildxpchildxpchildxpchildxpchildxpchildxpchildxpchildxpchildxpchildxpchildxpchildxpchildxpchildxpchildxpchildxpchildxpchildxpchildxpchildxpchildxpchildxpchildxpchildxpchildxpchildxpchildxpchildxpchildxpchildxpchildxpchildxpchildxpchildxpchildxpchildxpchildxpchildxpchildxpchildxpchildxpchildxpchildxpchildxpchildxpchildxpchildxpchildxpchildxpchildxpchildxpchildxpchildxpchildxpchildxpchildxpchildxpchildxpchildxpchildxpchildxpchildxpchildxpchildxpchildxpchildxpchildxpchildxpchildxpchildxpchildxpchildxpchildxpchildxpchildxpchildxpchildxpchildxpchildxpchildxpchildxpchildxpchildxpchildxpchildxpchildxpchildxpchildxpchildxpchildxpchildxpchildxpchildxpchildxpchildxpchildxpchildxpchildxpchildxpchildxpchildxpchildxpchildxpchildxpchildxpchildxpchildxpchildxpchildxpchildxpchildxpchildxpchildxpchildxpchildxpchildxpchildxpchildxpchildxpchildxpchildxpchildxpchildxpchildxpchildxpchildxpchildxpchildxpchildxpchildxpchildxpchildxpchildxpchildxpchildxpchildxpchildxpchildxpchildxpchildxpchildxpchildxpchildxpchildxpchildxpchildxpchildxpchildxpchildxpchildxpchildxpchildxpchildxpchildxpchildxpchildxpchildxpchildxpchildxpchildxpchildxpchildxpchildxpchildxpchildxpchildxpchildxpchildxpchildxpchildxpchildxpchildxpchildxpchildxpchildxpchildxpchildxpchildxpchildxpchildxpchildxpchildxpchildxpchildxpchildxpchildxpchildxpchildxpchildxpchildxpchildxpchildxpchildxpchildxpchildxpchildxpchildxpchildxpchildxpchildxpchildxpchildxpchildxpchildxpchildxpchildxpchildxpchildxpchildxpchildxpchildxpchildxpchildxpchildxpchildxpchildxpchildxpchildxpchildxpchildxpchildxpchildxpchildxpchildxpchildxpchildxpchildxpchildxpchildxpchildxpchildxpchildxpchildxpchildxpchildxpchildxpchildxpchildxpchildxpchildxpchildxpchildxpchildxpchildxpchildxpchildxpchildxpchildxpchildxpchildxpchildxpchildxpchildxpchildxpchildxpchildxpchildxpchildxpchildxpchildxpchildxpchildxpchildxpchildxpchildxpchildxpchildxpchildxpchildxpchildxpchildxpchildxpchildxpchildxpchildxpchildxpchildxpchildxpchildxpchildxpchildxpchildxpchildxpchildxpchildxpchildxpchildxpchildxpchildxpchildxpchildxpchildxpchildxpchildxpchildxpchildxpchildxpchildxpchildxpchildxpchildxpchildxpchildxpchildxpchildxpchildxpchildxpchildxpchildxpchildxpchildxpchildxpchildxpchildxpchildxpchildxpchildxpchildxpchildxpchildxpchildxpchildxpchildxpchildxpchildxpchildxpchildxpchildxpchildxpchildxpchildxpchildxpchildxpchildxpchildxpchildxpchildxpchildxpchildxpchildxpchildxpchildxpchildxpchildxpchildxpchildxpchildxpchildxpchildxpchildxpchildxpchildxpchildxpchildxpchildxpchildxpchildxpchildxpchildxpchildxpchildxpchildxpchildxpchildxpchildxpchildxpchildxpchildxpchildxpchildxpchildxpchildxpchildxpchildxpchildxpchildxpchildxpchildxpchildxpchildxpchildxpchildxpchildxpchildxpchildxpchildxpchildxpchildxpchildxpchildxpchildxpchildxpchildxpchildxpchildxpchildxpchildxpchildxpchildxpchildxpchildxpchildxpchildxpchildxpchildxpchildxpchildxpchildxpchildxpchildxpchildxpchildxpchildxpchildxpchildxpchildxpchildxpchildxpchildxpchildxpchildxpchildxpchildxpchildxpchildxpchildxpchildxpchildxpchildxpchildxpchildxpchildxpchildxpchildxpchildxpchildxpchildxpchildxpchildxpchildxpchildxpchildxpchildxpchildxpchildxpchildxpchildxpchildxpchildxpchildxpchildxpchildxpchildxpchildxpchildxpchildxpchildxpchildxpchildxpchildxpchildxpchildxpchildxpchildxpchildxpchildxpchildxpchildxpchildxpchildxpchildxpchildxpchildxpchildxpchildxpchildxpchildxpchildxpchildxpchildxpchildxpchildxpchildxpchildxpchildxpchildxpchildxpchildxpchildxpchildxpchildxpchildxpchildxpchildxpchildxpchildxpchildxpchildxpchildxpchildxpchildxpchildxpchildxpchildxpchildxpchildxpchildxpchildxpchildxpchildxpchildxpchildxpchildxpchildxpchildxpchildxpchildxpchildxpchildxpchildxpchildxpchildxpchildxpchildxpchildxpchildxpchildxpchildxpchildxpchildxpchildxpchildxpchildxpchildxpchildxpchildxpchildxpchildxpchildxpchildxpchildxpchildxpchildxpchildxpchildxpchildxpchildxpchildxpchildxpchildxpchildxpchildxpchildxpchildxpchildxpchildxpchildxpchildxpchildxpchildxpchildxpchildxpchildxpchildxpchildxpchildxpchildxpchildxpchildxpchildxpchildxpchildxpchildxpchildxpchildxpchildxpchildxpchildxpchildxpchildxpchildxpchildxpchildxpchildxpchildxpchildxpchildxpchildxpchildxpchildxpchildxpchildxpchildxpchildxpchildxpchildxpchildxpchildxpchildxpchildxpchildxpchildxpchildxpchildxpchildxpchildxpchildxpchildxpchildxpchildxpchildxpchildxpchildxpchildxpchildxpchildxpchildxpchildxpchildxpchildxpchildxpchildxpchildxpchildxpchildxpchildxpchildxpchildxpchildxpchildxpchildxpchildxpchildxpchildxpchildxpchildxpchildxpchildxpchildxpchildxpchildxpchildxpchildxpchildxpchildxpchildxpchildxpchildxpchildxpchildxpchildxpchildxpchildxpchildxpchildxpchildxpchildxpchildxpchildxpchildxpchildxpchildxpchildxpchildxpchildxpchildxpchildxpchildxpchildxpchildxpchildxpchildxpchildxpchildxpchildxpchildxpchildxpchildxpchildxpchildxpchildxpchildxpchildxpchildxpchildxpchildxpchildxpchildxpchildxpchildxpchildxpchildxpchildxpchildxpchildxpchildxpchildxpchildxpchildxpchildxpchildxpchildxpchildxpchildxpchildxpchildxpchildxpchildxpchildxpchildxpchildxpchildxpchildxpchildxpchildxpchildxpchildxpchildxpchildxpchildxpchildxpchildxpchildxpchildxpchildxpchildxpchildxpchildxpchildxpchildxpchildxpchildxpchildxpchildxpchildxpchildxpchildxpchildxpchildxpchildxpchildxpchildxpchildxpchildxpchildxpchildxpchildxpchildxpchildxpchildxpchildxpchildxpchildxpchildxpchildxpchildxpchildxpchildxpchildxpchildxpchildxpchildxpchildxpchildxpchildxpchildxpchildxpchildxpchildxpchildxpchildxpchildxpchildxpchildxpchildxpchildxpchildxpchildxpchildxpchildxpchildxpchildxpchildxpchildxpchildxpchildxpchildxpchildxpchildxpchildxpchildxpchildxpchildxpchildxpchildxpchildxpchildxpchildxpchildxpchildxpchildxpchildxpchildxpchildxpchildxpchildxpchildxpchildxpchildxpchildxpchildxpchildxpchildxpchildxpchildxpchildxpchildxpchildxpchildxpchildxpchildxpchildxpchildxpchildxpchildxpchildxpchildxpchildxpchildxpchildxpchildxpchildxpchildxpchildxpchildxpchildxpchildxpchildxpchildxpchildxpchildxpchildxpchildxpchildxpchildxpchildxpchildxpchildxpchildxpchildxpchildxpchildxpchildxpchildxpchildxpchildxpchildxpchildxpchildxpchildxpchildxpchildxpchildxpchildxpchildxpchildxpchildxpchildxpchildxpchildxpchildxpchildxpchildxpchildxpchildxpchildxpchildxpchildxpchildxpchildxpchildxpchildxpchildxpchildxpchildxpchildxpchildxpchildxpchildxpchildxpchildxpchildxpchildxpchildxpchildxpchildxpchildxpchildxpchildxpchildxpchildxpchildxpchildxpchildxpchildxpchildxpchildxpchildxpchildxpchildxpchildxpchildxpchildxpchildxpchildxpchildxpchildxpchildxpchildxpchildxpchildxpchildxpchildxpchildxpchildxpchildxpchildxpchildxpchildxpchildxpchildxpchildxpchildxpchildxpchildxpchildxpchildxpchildxpchildxpchildxpchildxpchildxpchildxpchildxpchildxpchildxpchildxpchildxpchildxpchildxpchildxpchildxpchildxpchildxpchildxpchildxpchildxpchildxpchildxpchildxpchildxpchildxpchildxpchildxpchildxpchildxpchildxpchildxpchildxpchildxpchildxpchildxpchildxpchildxpchildxpchildxpchildxpchildxpchildxpchildxpchildxpchildxpchildxpchildxpchildxpchildxpchildxpchildxpchildxpchildxpchildxpchildxpchildxpchildxpchildxpchildxpchildxpchildxpchildxpchildxpchildxpchildxpchildxpchildxpchildxpchildxpchildxpchildxpchildxpchildxpchildxpchildxpchildxpchildxpchildxpchildxpchildxpchildxpchildxpchildxpchildxpchildxpchildxpchildxpchildxpchildxpchildxpchildxpchildxpchildxpchildxpchildxpchildxpchildxpchildxpchildxpchildxpchildxpchildxpchildxpchildxpchildxpchildxpchildxpchildxpchildxpchildxpchildxpchildxpchildxpchildxpchildxpchildxpchildxpchildxpchildxpchildxpchildxpchildxpchildxpchildxpchildxpchildxpchildxpchildxpchildxpchildxpchildxpchildxpchildxpchildxpchildxpchildxpchildxpchildxpchildxpchildxpchildxpchildxpchildxpchildxpchildxpchildxpchildxpchildxpchildxpchildxpchildxpchildxpchildxpchildxpchildxpchildxpchildxpchildxpchildxpchildxpchildxpchildxpchildxpchildxpchildxpchildxpchildxpchildxpchildxpchildxpchildxpchildxpchildxpchildxpchildxpchildxpchildxpchildxpchildxpchildxpchildxpchildxpchildxpchildxpchildxpchildxpchildxpchildxpchildxpchildxpchildxpchildxpchildxpchildxpchildxpchildxpchildxpchildxpchildxpchildxpchildxpchildxpchildxpchildxpchildxpchildxpchildxpchildxpchildxpchildxpchildxpchildxpchildxpchildxpchildxpchildxpchildxpchildxpchildxpchildxpchildxpchildxpchildxpchildxpchildxpchildxpchildxpchildxpchildxpchildxpchildxpchildxpchildxpchildxpchildxpchildxpchildxpchildxpchildxpchildxpchildxpchildxpchildxpchildxpchildxpchildxpchildxpchildxpchildxpchildxpchildxpchildxpchildxpchildxpchildxpchildxpchildxpchildxpchildxpchildxpchildxpchildxpchildxpchildxpchildxpchildxpchildxpchildxpchildxpchildxpchildxpchildxpchildxpchildxpchildxpchildxpchildxpchildxpchildxpchildxpchildxpchildxpchildxpchildxpchildxpchildxpchildxpchildxpchildxpchildxpchildxpchildxpchildxpchildxpchildxpchildxpchildxpchildxpchildxpchildxpchildxpchildxpchildxpchildxpchildxpchildxpchildxpchildxpchildxpchildxpchildxpchildxpchildxpchildxpchildxpchildxpchildxpchildxpchildxpchildxpchildxpchildxpchildxpchildxpchildxpchildxpchildxpchildxpchildxpchildxpchildxpchildxpchildxpchildxpchildxpchildxpchildxpchildxpchildxpchildxpchildxpchildxpchildxpchildxpchildxpchildxpchildxpchildxpchildxpchildxpchildxpchildxpchildxpchildxpchildxpchildxpchildxpchildxpchildxpchildxpchildxpchildxpchildxpchildxpchildxpchildxpchildxpchildxpchildxpchildxpchildxpchildxpchildxpchildxpchildxpchildxpchildxpchildxpchildxpchildxpchildxpchildxpchildxpchildxpchildxpchildxpchildxpchildxpchildxpchildxpchildxpchildxpchildxpchildxpchildxpchildxpchildxpchildxpchildxpchildxpchildxpchildxpchildxpchildxpchildxpchildxpchildxpchildxpchildxpchildxpchildxpchildxpchildxpchildxpchildxpchildxpchildxpchildxpchildxpchildxpchildxpchildxpchildxpchildxpchildxpchildxpchildxpchildxpchildxpchildxpchildxpchildxpchildxpchildxpchildxpchildxpchildxpchildxpchildxpchildxpchildxpchildxpchildxpchildxpchildxpchildxpchildxpchildxpchildxpchildxpchildxpchildxpchildxpchildxpchildxpchildxpchildxpchildxpchildxpchildxpchildxpchildxpchildxpchildxpchildxpchildxpchildxpchildxpchildxpchildxpchildxpchildxpchildxpchildxpchildxpchildxpchildxpchildxpchildxpchildxpchildxpchildxpchildxpchildxpchildxpchildxpchildxpchildxpchildxpchildxpchildxpchildxpchildxpchildxpchildxpchildxpchildxpchildxpchildxpchildxpchildxpchildxpchildxpchildxpchildxpchildxpchildxpchildxpchildxpchildxpchildxpchildxpchildxpchildxpchildxpchildxpchildxpchildxpchildxpchildxpchildxpchildxpchildxpchildxpchildxpchildxpchildxpchildxpchildxpchildxpchildxpchildxpchildxpchildxpchildxpchildxpchildxpchildxpchildxpchildxpchildxpchildxpchildxpchildxpchildxpchildxpchildxpchildxpchildxpchildxpchildxpchildxpchildxpchildxpchildxpchildxpchildxpchildxpchildxpchildxpchildxpchildxpchildxpchildxpchildxpchildxpchildxpchildxpchildxpchildxpchildxpchildxpchildxpchildxpchildxpchildxpchildxpchildxpchildxpchildxpchildxpchildxpchildxpchildxpchildxpchildxpchildxpchildxpchildxpchildxpchildxpchildxpchildxpchildxpchildxpchildxpchildxpchildxpchildxpchildxpchildxpchildxpchildxpchildxpchildxpchildxpchildxpchildxpchildxpchildxpchildxpchildxpchildxpchildxpchildxpchildxpchildxpchildxpchildxpchildxpchildxpchildxpchildxpchildxpchildxpchildxpchildxpchildxpchildxpchildxpchildxpchildxpchildxpchildxpchildxpchildxpchildxpchildxpchildxpchildxpchildxpchildxpchildxpchildxpchildxpchildxpchildxpchildxpchildxpchildxpchildxpchildxpchildxpchildxpchildxpchildxpchildxpchildxpchildxpchildxpchildxpchildxpchildxpchildxpchildxpchildxpchildxpchildxpchildxpchildxpchildxpchildxpchildxpchildxpchildxpchildxpchildxpchildxpchildxpchildxpchildxpchildxpchildxpchildxpchildxpchildxpchildxpchildxpchildxpchildxpchildxpchildxpchildxpchildxpchildxpchildxpchildxpchildxpchildxpchildxpchildxpchildxpchildxpchildxpchildxpchildxpchildxpchildxpchildxpchildxpchildxpchildxpchildxpchildxpchildxpchildxpchildxpchildxpchildxpchildxpchildxpchildxpchildxpchildxpchildxpchildxpchildxpchildxpchildxpchildxpchildxpchildxpchildxpchildxpchildxpchildxpchildxpchildxpchildxpchildxpchildxpchildxpchildxpchildxpchildxpchildxpchildxpchildxpchildxpchildxpchildxpchildxpchildxpchildxpchildxpchildxpchildxpchildxpchildxpchildxpchildxpchildxpchildxpchildxpchildxpchildxpchildxpchildxpchildxpchildxpchildxpchildxpchildxpchildxpchildxpchildxpchildxpchildxpchildxpchildxpchildxpchildxpchildxpchildxpchildxpchildxpchildxpchildxpchildxpchildxpchildxpchildxpchildxpchildxpchildxpchildxpchildxpchildxpchildxpchildxpchildxpchildxpchildxpchildxpchildxpchildxpchildxpchildxpchildxpchildxpchildxpchildxpchildxpchildxpchildxpchildxpchildxpchildxpchildxpchildxpchildxpchildxpchildxpchildxpchildxpchildxpchildxpchildxpchildxpchildxpchildxpchildxpchildxpchildxpchildxpchildxpchildxpchildxpchildxpchildxpchildxpchildxpchildxpchildxpchildxpchildxpchildxpchildxpchildxpchildxpchildxpchildxpchildxpchildxpchildxpchildxpchildxpchildxpchildxpchildxpchildxpchildxpchildxpchildxpchildxpchildxpchildxpchildxpchildxpchildxpchildxpchildxpchildxpchildxpchildxpchildxpchildxpchildxpchildxpchildxpchildxpchildxpchildxpchildxpchildxpchildxpchildxpchildxpchildxpchildxpchildxpchildxpchildxpchildxpchildxpchildxpchildxpchildxpchildxpchildxpchildxpchildxpchildxpchildxpchildxpchildxpchildxpchildxpchildxpchildxpchildxpchildxpchildxpchildxpchildxpchildxpchildxpchildxpchildxpchildxpchildxpchildxpchildxpchildxpchildxpchildxpchildxpchildxpchildxpchildxpchildxpchildxpchildxpchildxpchildxpchildxpchildxpchildxpchildxpchildxpchildxpchildxpchildxpchildxpchildxpchildxpchildxpchildxpchildxpchildxpchildxpchildxpchildxpchildxpchildxpchildxpchildxpchildxpchildxpchildxpchildxpchildxpchildxpchildxpchildxpchildxpchildxpchildxpchildxpchildxpchildxpchildxpchildxpchildxpchildxpchildxpchildxpchildxpchildxpchildxpchildxpchildxpchildxpchildxpchildxpchildxpchildxpchildxpchildxpchildxpchildxpchildxpchildxpchildxpchildxpchildxpchildxpchildxpchildxpchildxpchildxpchildxpchildxpchildxpchildxpchildxpchildxpchildxpchildxpchildxpchildxpchildxpchildxpchildxpchildxpchildxpchildxpchildxpchildxpchildxpchildxpchildxpchildxpchildxpchildxpchildxpchildxpchildxpchildxpchildxpchildxpchildxpchildxpchildxpchildxpchildxpchildxpchildxpchildxpchildxpchildxpchildxpchildxpchildxpchildxpchildxpchildxpchildxpchildxpchildxpchildxpchildxpchildxpchildxpchildxpchildxpchildxpchildxpchildxpchildxpchildxpchildxpchildxpchildxpchildxpchildxpchildxpchildxpchildxpchildxpchildxpchildxpchildxpchildxpchildxpchildxpchildxpchildxpchildxpchildxpchildxpchildxpchildxpchildxpchildxpchildxpchildxpchildxpchildxpchildxpchildxpchildxpchildxpchildxpchildxpchildxpchildxpchildxpchildxpchildxpchildxpchildxpchildxpchildxpchildxpchildxpchildxpchildxpchildxpchildxpchildxpchildxpchildxpchildxpchildxpchildxpchildxpchildxpchildxpchildxpchildxpchildxpchildxpchildxpchildxpchildxpchildxpchildxpchildxpchildxpchildxpchildxpchildxpchildxpchildxpchildxpchildxpchildxpchildxpchildxpchildxpchildxpchildxpchildxpchildxpchildxpchildxpchildxpchildxpchildxpchildxpchildxpchildxpchildxpchildxpchildxpchildxpchildxpchildxpchildxpchildxpchildxpchildxpchildxpchildxpchildxpchildxpchildxpchildxpchildxpchildxpchildxpchildxpchildxpchildxpchildxpchildxpchildxpchildxpchildxpchildxpchildxpchildxpchildxpchildxpchildxpchildxpchildxpchildxpchildxpchildxpchildxpchildxpchildxpchildxpchildxpchildxpchildxpchildxpchildxpchildxpchildxpchildxpchildxpchildxpchildxpchildxpchildxpchildxpchildxpchildxpchildxpchildxpchildxpchildxpchildxpchildxpchildxpchildxpchildxpchildxpchildxpchildxpchildxpchildxpchildxpchildxpchildxpchildxpchildxpchildxpchildxpchildxpchildxpchildxpchildxpchildxpchildxpchildxpchildxpchildxpchildxpchildxpchildxpchildxpchildxpchildxpchildxpchildxpchildxpchildxpchildxpchildxpchildxpchildxpchildxpchildxpchildxpchildxpchildxpchildxpchildxpchildxpchildxpchildxpchildxpchildxpchildxpchildxpchildxpchildxpchildxpchildxpchildxpchildxpchildxpchildxpchildxpchildxpchildxpchildxpchildxpchildxpchildxpchildxpchildxpchildxpchildxpchildxpchildxpchildxpchildxpchildxpchildxpchildxpchildxpchildxpchildxpchildxpchildxpchildxpchildxpchildxpchildxpchildxpchildxpchildxpchildxpchildxpchildxpchildxpchildxpchildxpchildxpchildxpchildxpchildxpchildxpchildxpchildxpchildxpchildxpchildxpchildxpchildxpchildxpchildxpchildxpchildxpchildxpchildxpchildxpchildxpchildxpchildxpchildxpchildxpchildxpchildxpchildxpchildxpchildxpchildxpchildxpchildxpchildxpchildxpchildxpchildxpchildxpchildxpchildxpchildxpchildxpchildxpchildxpchildxpchildxpchildxpchildxpchildxpchildxpchildxpchildxpchildxpchildxpchildxpchildxpchildxpchildxpchildxpchildxpchildxpchildxpchildxpchildxpchildxpchildxpchildxpchildxpchildxpchildxpchildxpchildxpchildxpchildxpchildxpchildxpchildxpchildxpchildxpchildxpchildxpchildxpchildxpchildxpchildxpchildxpchildxpchildxpchildxpchildxpchildxpchildxpchildxpchildxpchildxpchildxpchildxpchildxpchildxpchildxpchildxpchildxpchildxpchildxpchildxpchildxpchildxpchildxpchildxpchildxpchildxpchildxpchildxpchildxpchildxpchildxpchildxpchildxpchildxpchildxpchildxpchildxpchildxpchildxpchildxpchildxpchildxpchildxpchildxpchildxpchildxpchildxpchildxpchildxpchildxpchildxpchildxpchildxpchildxpchildxpchildxpchildxpchildxpchildxpchildxpchildxpchildxpchildxpchildxpchildxpchildxpchildxpchildxpchildxpchildxpchildxpchildxpchildxpchildxpchildxpchildxpchildxpchildxpchildxpchildxpchildxpchildxpchildxpchildxpchildxpchildxpchildxpchildxpchildxpchildxpchildxpchildxpchildxpchildxpchildxpchildxpchildxpchildxpchildxpchildxpchildxpchildxpchildxpchildxpchildxpchildxpchildxpchildxpchildxpchildxpchildxpchildxpchildxpchildxpchildxpchildxpchildxpchildxpchildxpchildxpchildxpchildxpchildxpchildxpchildxpchildxpchildxpchildxpchildxpchildxpchildxpchildxpchildxpchildxpchildxpchildxpchildxpchildxpchildxpchildxpchildxpchildxpchildxpchildxpchildxpchildxpchildxpchildxpchildxpchildxpchildxpchildxpchildxpchildxpchildxpchildxpchildxpchildxpchildxpchildxpchildxpchildxpchildxpchildxpchildxpchildxpchildxpchildxpchildxpchildxpchildxpchildxpchildxpchildxpchildxpchildxpchildxpchildxpchildxpchildxpchildxpchildxpchildxpchildxpchildxpchildxpchildxpchildxpchildxpchildxpchildxpchildxpchildxpchildxpchildxpchildxpchildxpchildxpchildxpchildxpchildxpchildxpchildxpchildxpchildxpchildxpchildxpchildxpchildxpchildxpchildxpchildxpchildxpchildxpchildxpchildxpchildxpchildxpchildxpchildxpchildxpchildxpchildxpchildxpchildxpchildxpchildxpchildxpchildxpchildxpchildxpchildxpchildxpchildxpchildxpchildxpchildxpchildxpchildxpchildxpchildxpchildxpchildxpchildxpchildxpchildxpchildxpchildxpchildxpchildxpchildxpchildxpchildxpchildxpchildxpchildxpchildxpchildxpchildxpchildxpchildxpchildxpchildxpchildxpchildxpchildxpchildxpchildxpchildxpchildxpchildxpchildxpchildxpchildxpchildxpchildxpchildxpchildxpchildxpchildxpchildxpchildxpchildxpchildxpchildxpchildxpchildxpchildxpchildxpchildxpchildxpchildxpchildxpchildxpchildxpchildxpchildxpchildxpchildxpchildxpchildxpchildxpchildxpchildxpchildxpchildxpchildxpchildxpchildxpchildxpchildxpchildxpchildxpchildxpchildxpchildxpchildxpchildxpchildxpchildxpchildxpchildxpchildxpchildxpchildxpchildxpchildxpchildxpchildxpchildxpchildxpchildxpchildxpchildxpchildxpchildxpchildxpchildxpchildxpchildxpchildxpchildxpchildxpchildxpchildxpchildxpchildxpchildxpchildxpchildxpchildxpchildxpchildxpchildxpchildxpchildxpchildxpchildxpchildxpchildxpchildxpchildxpchildxpchildxpchildxpchildxpchildxpchildxpchildxpchildxpchildxpchildxpchildxpchildxpchildxpchildxpchildxpchildxpchildxpchildxpchildxpchildxpchildxpchildxpchildxpchildxpchildxpchildxpchildxpchildxpchildxpchildxpchildxpchildxpchildxpchildxpchildxpchildxpchildxpchildxpchildxpchildxpchildxpchildxpchildxpchildxpchildxpchildxpchildxpchildxpchildxpchildxpchildxpchildxpchildxpchildxpchildxpchildxpchildxpchildxpchildxpchildxpchildxpchildxpchildxpchildxpchildxpchildxpchildxpchildxpchildxpchildxpchildxpchildxpchildxpchildxpchildxpchildxpchildxpchildxpchildxpchildxpchildxpchildxpchildxpchildxpchildxpchildxpchildxpchildxpchildxpchildxpchildxpchildxpchildxpchildxpchildxpchildxpchildxpchildxpchildxpchildxpchildxpchildxpchildxpchildxpchildxpchildxpchildxpchildxpchildxpchildxpchildxpchildxpchildxpchildxpchildxpchildxpchildxpchildxpchildxpchildxpchildxpchildxpchildxpchildxpchildxpchildxpchildxpchildxpchildxpchildxpchildxpchildxpchildxpchildxpchildxpchildxpchildxpchildxpchildxpchildxpchildxpchildxpchildxpchildxpchildxpchildxpchildxpchildxpchildxpchildxpchildxpchildxpchildxpchildxpchildxpchildxpchildxpchildxpchildxpchildxpchildxpchildxpchildxpchildxpchildxpchildxpchildxpchildxpchildxpchildxpchildxpchildxpchildxpchildxpchildxpchildxpchildxpchildxpchildxpchildxpchildxpchildxpchildxpchildxpchildxpchildxpchildxpchildxpchildxpchildxpchildxpchildxpchildxpchildxpchildxpchildxpchildxpchildxpchildxpchildxpchildxpchildxpchildxpchildxpchildxpchildxpchildxpchildxpchildxpchildxpchildxpchildxpchildxpchildxpchildxpchildxpchildxpchildxpchildxpchildxpchildxpchildxpchildxpchildxpchildxpchildxpchildxpchildxpchildxpchildxpchildxpchildxpchildxpchildxpchildxpchildxpchildxpchildxpchildxpchildxpchildxpchildxpchildxpchildxpchildxpchildxpchildxpchildxpchildxpchildxpchildxpchildxpchildxpchildxpchildxpchildxpchildxpchildxpchildxpchildxpchildxpchildxpchildxpchildxpchildxpchildxpchildxpchildxpchildxpchildxpchildxpchildxpchildxpchildxpchildxpchildxpchildxpchildxpchildxpchildxpchildxpchildxpchildxpchildxpchildxpchildxpchildxpchildxpchildxpchildxpchildxpchildxpchildxpchildxpchildxpchildxpchildxpchildxpchildxpchildxpchildxpchildxpchildxpchildxpchildxpchildxpchildxpchildxpchildxpchildxpchildxpchildxpchildxpchildxpchildxpchildxpchildxpchildxpchildxpchildxpchildxpchildxpchildxpchildxpchildxpchildxpchildxpchildxpchildxpchildxpchildxpchildxpchildxpchildxpchildxpchildxpchildxpchildxpchildxpchildxpchildxpchildxpchildxpchildxpchildxpchildxpchildxpchildxpchildxpchildxpchildxpchildxpchildxpchildxpchildxpchildxpchildxpchildxpchildxpchildxpchildxpchildxpchildxpchildxpchildxpchildxpchildxpchildxpchildxpchildxpchildxpchildxpchildxpchildxpchildxpchildxpchildxpchildxpchildxpchildxpchildxpchildxpchildxpchildxpchildxpchildxpchildxpchildxpchildxpchildxpchildxpchildxpchildxpchildxpchildxpchildxpchildxpchildxpchildxpchildxpchildxpchildxpchildxpchildxpchildxpchildxpchildxpchildxpchildxpchildxpchildxpchildxpchildxpchildxpchildxpchildxpchildxpchildxpchildxpchildxpchildxpchildxpchildxpchildxpchildxpchildxpchildxpchildxpchildxpchildxpchildxpchildxpchildxpchildxpchildxpchildxpchildxpchildxpchildxpchildxpchildxpchildxpchildxpchildxpchildxpchildxpchildxpchildxpchildxpchildxpchildxpchildxpchildxpchildxpchildxpchildxpchildxpchildxpchildxpchildxpchildxpchildxpchildxpchildxpchildxpchildxpchildxpchildxpchildxpchildxpchildxpchildxpchildxpchildxpchildxpchildxpchildxpchildxpchildxpchildxpchildxpchildxpchildxpchildxpchildxpchildxpchildxpchildxpchildxpchildxpchildxpchildxpchildxpchildxpchildxpchildxpchildxpchildxpchildxpchildxpchildxpchildxpchildxpchildxpchildxpchildxpchildxpchildxpchildxpchildxpchildxpchildxpchildxpchildxpchildxpchildxpchildxpchildxpchildxpchildxpchildxpchildxpchildxpchildxpchildxpchildxpchildxpchildxpchildxpchildxpchildxpchildxpchildxpchildxpchildxpchildxpchildxpchildxpchildxpchildxpchildxpchildxpchildxpchildxpchildxpchildxpchildxpchildxpchildxpchildxpchildxpchildxpchildxpchildxpchildxpchildxpchildxpchildxpchildxpchildxpchildxpchildxpchildxpchildxpchildxpchildxpchildxpchildxpchildxpchildxpchildxpchildxpchildxpchildxpchildxpchildxpchildxpchildxpchildxpchildxpchildxpchildxpchildxpchildxpchildxpchildxpchildxpchildxpchildxpchildxpchildxpchildxpchildxpchildxpchildxpchildxpchildxpchildxpchildxpchildxpchildxpchildxpchildxpchildxpchildxpchildxpchildxpchildxpchildxpchildxpchildxpchildxpchildxpchildxpchildxpchildxpchildxpchildxpchildxpchildxpchildxpchildxpchildxpchildxpchildxpchildxpchildxpchildxpchildxpchildxpchildxpchildxpchildxpchildxpchildxpchildxpchildxpchildxpchildxpchildxpchildxpchildxpchildxpchildxpchildxpchildxpchildxpchildxpchildxpchildxpchildxpchildxpchildxpchildxpchildxpchildxpchildxpchildxpchildxpchildxpchildxpchildxpchildxpchildxpchildxpchildxpchildxpchildxpchildxpchildxpchildxpchildxpchildxpchildxpchildxpchildxpchildxpchildxpchildxpchildxpchildxpchildxpchildxpchildxpchildxpchildxpchildxpchildxpchildxpchildxpchildxpchildxpchildxpchildxpchildxpchildxpchildxpchildxpchildxpchildxpchildxpchildxpchildxpchildxpchildxpchildxpchildxpchildxpchildxpchildxpchildxpchildxpchildxpchildxpchildxpchildxpchildxpchildxpchildxpchildxpchildxpchildxpchildxpchildxpchildxpchildxpchildxpchildxpchildxpchildxpchildxpchildxpchildxpchildxpchildxpchildxpchildxpchildxpchildxpchildxpchildxpchildxpchildxpchildxpchildxpchildxpchildxpchildxpchildxpchildxpchildxpchildxpchildxpchildxpchildxpchildxpchildxpchildxpchildxpchildxpchildxpchildxpchildxpchildxpchildxpchildxpchildxpchildxpchildxpchildxpchildxpchildxpchildxpchildxpchildxpchildxpchildxpchildxpchildxpchildxpchildxpchildxpchildxpchildxpchildxpchildxpchildxpchildxpchildxpchildxpchildxpchildxpchildxpchildxpchildxpchildxpchildxpchildxpchildxpchildxpchildxpchildxpchildxpchildxpchildxpchildxpchildxpchildxpchildxpchildxpchildxpchildxpchildxpchildxpchildxpchildxpchildxpchildxpchildxpchildxpchildxpchildxpchildxpchildxpchildxpchildxpchildxpchildxpchildxpchildxpchildxpchildxpchildxpchildxpchildxpchildxpchildxpchildxpchildxpchildxpchildxpchildxpchildxpchildxpchildxpchildxpchildxpchildxpchildxpchildxpchildxpchildxpchildxpchildxpchildxpchildxpchildxpchildxpchildxpchildxpchildxpchildxpchildxpchildxpchildxpchildxpchildxpchildxpchildxpchildxpchildxpchildxpchildxpchildxpchildxpchildxpchildxpchildxpchildxpchildxpchildxpchildxpchildxpchildxpchildxpchildxpchildxpchildxpchildxpchildxpchildxpchildxpchildxpchildxpchildxpchildxpchildxpchildxpchildxpchildxpchildxpchildxpchildxpchildxpchildxpchildxpchildxpchildxpchildxpchildxpchildxpchildxpchildxpchildxpchildxpchildxpchildxpchildxpchildxpchildxpchildxpchildxpchildxpchildxpchildxpchildxpchildxpchildxpchildxpchildxpchildxpchildxpchildxpchildxpchildxpchildxpchildxpchildxpchildxpchildxpchildxpchildxpchildxpchildxpchildxpchildxpchildxpchildxpchildxpchildxpchildxpchildxpchildxpchildxpchildxpchildxpchildxpchildxpchildxpchildxpchildxpchildxpchildxpchildxpchildxpchildxpchildxpchildxpchildxpchildxpchildxpchildxpchildxpchildxpchildxpchildxpchildxpchildxpchildxpchildxpchildxpchildxpchildxpchildxpchildxpchildxpchildxpchildxpchildxpchildxpchildxpchildxpchildxpchildxpchildxpchildxpchildxpchildxpchildxpchildxpchildxpchildxpchildxpchildxpchildxpchildxpchildxpchildxpchildxpchildxpchildxpchildxpchildxpchildxpchildxpchildxpchildxpchildxpchildxpchildxpchildxpchildxpchildxpchildxpchildxpchildxpchildxpchildxpchildxpchildxpchildxpchildxpchildxpchildxpchildxpchildxpchildxpchildxpchildxpchildxpchildxpchildxpchildxpchildxpchildxpchildxpchildxpchildxpchildxpchildxpchildxpchildxpchildxpchildxpchildxpchildxpchildxpchildxpchildxpchildxpchildxpchildxpchildxpchildxpchildxpchildxpchildxpchildxpchildxpchildxpchildxpchildxpchildxpchildxpchildxpchildxpchildxpchildxpchildxpchildxpchildxpchildxpchildxpchildxpchildxpchildxpchildxpchildxpchildxpchildxpchildxpchildxpchildxpchildxpchildxpchildxpchildxpchildxpchildxpchildxpchildxpchildxpchildxpchildxpchildxpchildxpchildxpchildxpchildxpchildxpchildxpchildxpchildxpchildxpchildxpchildxpchildxpchildxpchildxpchildxpchildxpchildxpchildxpchildxpchildxpchildxpchildxpchildxpchildxpchildxpchildxpchildxpchildxpchildxpchildxpchildxpchildxpchildxpchildxpchildxpchildxpchildxpchildxpchildxpchildxpchildxpchildxpchildxpchildxpchildxpchildxpchildxpchildxpchildxpchildxpchildxpchildxpchildxpchildxpchildxpchildxpchildxpchildxpchildxpchildxpchildxpchildxpchildxpchildxpchildxpchildxpchildxpchildxpchildxpchildxpchildxpchildxpchildxpchildxpchildxpchildxpchildxpchildxpchildxpchildxpchildxpchildxpchildxpchildxpchildxpchildxpchildxpchildxpchildxpchildxpchildxpchildxpchildxpchildxpchildxpchildxpchildxpchildxpchildxpchildxpchildxpchildxpchildxpchildxpchildxpchildxpchildxpchildxpchildxpchildxpchildxpchildxpchildxpchildxpchildxpchildxpchildxpchildxpchildxpchildxpchildxpchildxpchildxpchildxpchildxpchildxpchildxpchildxpchildxpchildxpchildxpchildxpchildxpchildxpchildxpchildxpchildxpchildxpchildxpchildxpchildxpchildxpchildxpchildxpchildxpchildxpchildxpchildxpchildxpchildxpchildxpchildxpchildxpchildxpchildxpchildxpchildxpchildxpchildxpchildxpchildxpchildxpchildxpchildxpchildxpchildxpchildxpchildxpchildxpchildxpchildxpchildxpchildxpchildxpchildxpchildxpchildxpchildxpchildxpchildxpchildxpchildxpchildxpchildxpchildxpchildxpchildxpchildxpchildxpchildxpchildxpchildxpchildxpchildxpchildxpchildxpchildxpchildxpchildxpchildxpchildxpchildxpchildxpchildxpchildxpchildxpchildxpchildxpchildxpchildxpchildxpchildxpchildxpchildxpchildxpchildxpchildxpchildxpchildxpchildxpchildxpchildxpchildxpchildxpchildxpchildxpchildxpchildxpchildxpchildxpchildxpchildxpchildxpchildxpchildxpchildxpchildxpchildxpchildxpchildxpchildxpchildxpchildxpchildxpchildxpchildxpchildxpchildxpchildxpchildxpchildxpchildxpchildxpchildxpchildxpchildxpchildxpchildxpchildxpchildxpchildxpchildxpchildxpchildxpchildxpchildxpchildxpchildxpchildxpchildxpchildxpchildxpchildxpchildxpchildxpchildxpchildxpchildxpchildxpchildxpchildxpchildxpchildxpchildxpchildxpchildxpchildxpchildxpchildxpchildxpchildxpchildxpchildxpchildxpchildxpchildxpchildxpchildxpchildxpchildxpchildxpchildxpchildxpchildxpchildxpchildxpchildxpchildxpchildxpchildxpchildxpchildxpchildxpchildxpchildxpchildxpchildxpchildxpchildxpchildxpchildxpchildxpchildxpchildxpchildxpchildxpchildxpchildxpchildxpchildxpchildxpchildxpchildxpchildxpchildxpchildxpchildxpchildxpchildxpchildxpchildxpchildxpchildxpchildxpchildxpchildxpchildxpchildxpchildxpchildxpchildxpchildxpchildxpchildxpchildxpchildxpchildxpchildxpchildxpchildxpchildxpchildxpchildxpchildxpchildxpchildxpchildxpchildxpchildxpchildxpchildxpchildxpchildxpchildxpchildxpchildxpchildxpchildxpchildxpchildxpchildxpchildxpchildxpchildxpchildxpchildxpchildxpchildxpchildxpchildxpchildxpchildxpchildxpchildxpchildxpchildxpchildxpchildxpchildxpchildxpchildxpchildxpchildxpchildxpchildxpchildxpchildxpchildxpchildxpchildxpchildxpchildxpchildxpchildxpchildxpchildxpchildxpchildxpchildxpchildxpchildxpchildxpchildxpchildxpchildxpchildxpchildxpchildxpchildxpchildxpchildxpchildxpchildxpchildxpchildxpchildxpchildxpchildxpchildxpchildxpchildxpchildxpchildxpchildxpchildxpchildxpchildxpchildxpchildxpchildxpchildxpchildxpchildxpchildxpchildxpchildxpchildxpchildxpchildxpchildxpchildxpchildxpchildxpchildxpchildxpchildxpchildxpchildxpchildxpchildxpchildxpchildxpchildxpchildxpchildxpchildxpchildxpchildxpchildxpchildxpchildxpchildxpchildxpchildxpchildxpchildxpchildxpchildxpchildxpchildxpchildxpchildxpchildxpchildxpchildxpchildxpchildxpchildxpchildxpchildxpchildxpchildxpchildxpchildxpchildxpchildxpchildxpchildxpchildxpchildxpchildxpchildxpchildxpchildxpchildxpchildxpchildxpchildxpchildxpchildxpchildxpchildxpchildxpchildxpchildxpchildxpchildxpchildxpchildxpchildxpchildxpchildxpchildxpchildxpchildxpchildxpchildxpchildxpchildxpchildxpchildxpchildxpchildxpchildxpchildxpchildxpchildxpchildxpchildxpchildxpchildxpchildxpchildxpchildxpchildxpchildxpchildxpchildxpchildxpchildxpchildxpchildxpchildxpchildxpchildxpchildxpchildxpchildxpchildxpchildxpchildxpchildxpchildxpchildxpchildxpchildxpchildxpchildxpchildxpchildxpchildxpchildxpchildxpchildxpchildxpchildxpchildxpchildxpchildxpchildxpchildxpchildxpchildxpchildxpchildxpchildxpchildxpchildxpchildxpchildxpchildxpchildxpchildxpchildxpchildxpchildxpchildxpchildxpchildxpchildxpchildxpchildxpchildxpchildxpchildxpchildxpchildxpchildxpchildxpchildxpchildxpchildxpchildxpchildxpchildxpchildxpchildxpchildxpchildxpchildxpchildxpchildxpchildxpchildxpchildxpchildxpchildxpchildxpchildxpchildxpchildxpchildxpchildxpchildxpchildxpchildxpchildxpchildxpchildxpchildxpchildxpchildxpchildxpchildxpchildxpchildxpchildxpchildxpchildxpchildxpchildxpchildxpchildxpchildxpchildxpchildxpchildxpchildxpchildxpchildxpchildxpchildxpchildxpchildxpchildxpchildxpchildxpchildxpchildxpchildxpchildxpchildxpchildxpchildxpchildxpchildxpchildxpchildxpchildxpchildxpchildxpchildxpchildxpchildxpchildxpchildxpchildxpchildxpchildxpchildxpchildxpchildxpchildxpchildxpchildxpchildxpchildxpchildxpchildxpchildxpchildxpchildxpchildxpchildxpchildxpchildxpchildxpchildxpchildxpchildxpchildxpchildxpchildxpchildxpchildxpchildxpchildxpchildxpchildxpchildxpchildxpchildxpchildxpchildxpchildxpchildxpchildxpchildxpchildxpchildxpchildxpchildxpchildxpchildxpchildxpchildxpchildxpchildxpchildxpchildxpchildxpchildxpchildxpchildxpchildxpchildxpchildxpchildxpchildxpchildxpchildxpchildxpchildxpchildxpchildxpchildxpchildxpchildxpchildxpchildxpchildxpchildxpchildxpchildxpchildxpchildxpchildxpchildxpchildxpchildxpchildxpchildxpchildxpchildxpchildxpchildxpchildxpchildxpchildxpchildxpchildxpchildxpchildxpchildxpchildxpchildxpchildxpchildxpchildxpchildxpchildxpchildxpchildxpchildxpchildxpchildxpchildxpchildxpchildxpchildxpchildxpchildxpchildxpchildxpchildxpchildxpchildxpchildxpchildxpchildxpchildxpchildxpchildxpchildxpchildxpchildxpchildxpchildxpchildxpchildxpchildxpchildxpchildxpchildxpchildxpchildxpchildxpchildxpchildxpchildxpchildxpchildxpchildxpchildxpchildxpchildxpchildxpchildxpchildxpchildxpchildxpchildxpchildxpchildxpchildxpchildxpchildxpchildxpchildxpchildxpchildxpchildxpchildxpchildxpchildxpchildxpchildxpchildxpchildxpchildxpchildxpchildxpchildxpchildxpchildxpchildxpchildxpchildxpchildxpchildxpchildxpchildxpchildxpchildxpchildxpchildxpchildxpchildxpchildxpchildxpchildxpchildxpchildxpchildxpchildxpchildxpchildxpchildxpchildxpchildxpchildxpchildxpchildxpchildxpchildxpchildxpchildxpchildxpchildxpchildxpchildxpchildxpchildxpchildxpchildxpchildxpchildxpchildxpchildxpchildxpchildxpchildxpchildxpchildxpchildxpchildxpchildxpchildxpchildxpchildxpchildxpchildxpchildxpchildxpchildxpchildxpchildxpchildxpchildxpchildxpchildxpchildxpchildxpchildxpchildxpchildxpchildxpchildxpchildxpchildxpchildxpchildxpchildxpchildxpchildxpchildxpchildxpchildxpchildxpchildxpchildxpchildxpchildxpchildxpchildxpchildxpchildxpchildxpchildxpchildxpchildxpchildxpchildxpchildxpchildxpchildxpchildxpchildxpchildxpchildxpchildxpchildxpchildxpchildxpchildxpchildxpchildxpchildxpchildxpchildxpchildxpchildxpchildxpchildxpchildxpchildxpchildxpchildxpchildxpchildxpchildxpchildxpchildxpchildxpchildxpchildxpchildxpchildxpchildxpchildxpchildxpchildxpchildxpchildxpchildxpchildxpchildxpchildxpchildxpchildxpchildxpchildxpchildxpchildxpchildxpchildxpchildxpchildxpchildxpchildxpchildxpchildxpchildxpchildxpchildxpchildxpchildxpchildxpchildxpchildxpchildxpchildxpchildxpchildxpchildxpchildxpchildxpchildxpchildxpchildxpchildxpchildxpchildxpchildxpchildxpchildxpchildxpchildxpchildxpchildxpchildxpchildxpchildxpchildxpchildxpchildxpchildxpchildxpchildxpchildxpchildxpchildxpchildxpchildxpchildxpchildxpchildxpchildxpchildxpchildxpchildxpchildxpchildxpchildxpchildxpchildxpchildxpchildxpchildxpchildxpchildxpchildxpchildxpchildxpchildxpchildxpchildxpchildxpchildxpchildxpchildxpchildxpchildxpchildxpchildxpchildxpchildxpchildxpchildxpchildxpchildxpchildxpchildxpchildxpchildxpchildxpchildxpchildxpchildxpchildxpchildxpchildxpchildxpchildxpchildxpchildxpchildxpchildxpchildxpchildxpchildxpchildxpchildxpchildxpchildxpchildxpchildxpchildxpchildxpchildxpchildxpchildxpchildxpchildxpchildxpchildxpchildxpchildxpchildxpchildxpchildxpchildxpchildxpchildxpchildxpchildxpchildxpchildxpchildxpchildxpchildxpchildxpchildxpchildxpchildxpchildxpchildxpchildxpchildxpchildxpchildxpchildxpchildxpchildxpchildxpchildxpchildxpchildxpchildxpchildxpchildxpchildxpchildxpchildxpchildxpchildxpchildxpchildxpchildxpchildxpchildxpchildxpchildxpchildxpchildxpchildxpchildxpchildxpchildxpchildxpchildxpchildxpchildxpchildxpchildxpchildxpchildxpchildxpchildxpchildxpchildxpchildxpchildxpchildxpchildxpchildxpchildxpchildxpchildxpchildxpchildxpchildxpchildxpchildxpchildxpchildxpchildxpchildxpchildxpchildxpchildxpchildxpchildxpchildxpchildxpchildxpchildxpchildxpchildxpchildxpchildxpchildxpchildxpchildxpchildxpchildxpchildxpchildxpchildxpchildxpchildxpchildxpchildxpchildxpchildxpchildxpchildxpchildxpchildxpchildxpchildxpchildxpchildxpchildxpchildxpchildxpchildxpchildxpchildxpchildxpchildxpchildxpchildxpchildxpchildxpchildxpchildxpchildxpchildxpchildxpchildxpchildxpchildxpchildxpchildxpchildxpchildxpchildxpchildxpchildxpchildxpchildxpchildxpchildxpchildxpchildxpchildxpchildxpchildxpchildxpchildxpchildxpchildxpchildxpchildxpchildxpchildxpchildxpchildxpchildxpchildxpchildxpchildxpchildxpchildxpchildxpchildxpchildxpchildxpchildxpchildxpchildxpchildxpchildxpchildxpchildxpchildxpchildxpchildxpchildxpchildxpchildxpchildxpchildxpchildxpchildxpchildxpchildxpchildxpchildxpchildxpchildxpchildxpchildxpchildxpchildxpchildxpchildxpchildxpchildxpchildxpchildxpchildxpchildxpchildxpchildxpchildxpchildxpchildxpchildxpchildxpchildxpchildxpchildxpchildxpchildxpchildxpchildxpchildxpchildxpchildxpchildxpchildxpchildxpchildxpchildxpchildxpchildxpchildxpchildxpchildxpchildxpchildxpchildxpchildxpchildxpchildxpchildxpchildxpchildxpchildxpchildxpchildxpchildxpchildxpchildxpchildxpchildxpchildxpchildxpchildxpchildxpchildxpchildxpchildxpchildxpchildxpchildxpchildxpchildxpchildxpchildxpchildxpchildxpchildxpchildxpchildxpchildxpchildxpchildxpchildxpchildxpchildxpchildxpchildxpchildxpchildxpchildxpchildxpchildxpchildxpchildxpchildxpchildxpchildxpchildxpchildxpchildxpchildxpchildxpchildxpchildxpchildxpchildxpchildxpchildxpchildxpchildxpchildxpchildxpchildxpchildxpchildxpchildxpchildxpchildxpchildxpchildxpchildxpchildxpchildxpchildxpchildxpchildxpchildxpchildxpchildxpchildxpchildxpchildxpchildxpchildxpchildxpchildxpchildxpchildxpchildxpchildxpchildxpchildxpchildxpchildxpchildxpchildxpchildxpchildxpchildxpchildxpchildxpchildxpchildxpchildxpchildxpchildxpchildxpchildxpchildxpchildxpchildxpchildxpchildxpchildxpchildxpchildxpchildxpchildxpchildxpchildxpchildxpchildxpchildxpchildxpchildxpchildxpchildxpchildxpchildxpchildxpchildxpchildxpchildxpchildxpchildxpchildxpchildxpchildxpchildxpchildxpchildxpchildxpchildxpchildxpchildxpchildxpchildxpchildxpchildxpchildxpchildxpchildxpchildxpchildxpchildxpchildxpchildxpchildxpchildxpchildxpchildxpchildxpchildxpchildxpchildxpchildxpchildxpchildxpchildxpchildxpchildxpchildxpchildxpchildxpchildxpchildxpchildxpchildxpchildxpchildxpchildxpchildxpchildxpchildxpchildxpchildxpchildxpchildxpchildxpchildxpchildxpchildxpchildxpchildxpchildxpchildxpchildxpchildxpchildxpchildxpchildxpchildxpchildxpchildxpchildxpchildxpchildxpchildxpchildxpchildxpchildxpchildxpchildxpchildxpchildxpchildxpchildxpchildxpchildxpchildxpchildxpchildxpchildxpchildxpchildxpchildxpchildxpchildxpchildxpchildxpchildxpchildxpchildxpchildxpchildxpchildxpchildxpchildxpchildxpchildxpchildxpchildxpchildxpchildxpchildxpchildxpchildxpchildxpchildxpchildxpchildxpchildxpchildxpchildxpchildxpchildxpchildxpchildxpchildxpchildxpchildxpchildxpchildxpchildxpchildxpchildxpchildxpchildxpchildxpchildxpchildxpchildxpchildxpchildxpchildxpchildxpchildxpchildxpchildxpchildxpchildxpchildxpchildxpchildxpchildxpchildxpchildxpchildxpchildxpchildxpchildxpchildxpchildxpchildxpchildxpchildxpchildxpchildxpchildxpchildxpchildxpchildxpchildxpchildxpchildxpchildxpchildxpchildxpchildxpchildxpchildxpchildxpchildxpchildxpchildxpchildxpchildxpchildxpchildxpchildxpchildxpchildxpchildxpchildxpchildxpchildxpchildxpchildxpchildxpchildxpchildxpchildxpchildxpchildxpchildxpchildxpchildxpchildxpchildxpchildxpchildxpchildxpchildxpchildxpchildxpchildxpchildxpchildxpchildxpchildxpchildxpchildxpchildxpchildxpchildxpchildxpchildxpchildxpchildxpchildxpchildxpchildxpchildxpchildxpchildxpchildxpchildxpchildxpchildxpchildxpchildxpchildxpchildxpchildxpchildxpchildxpchildxpchildxpchildxpchildxpchildxpchildxpchildxpchildxpchildxpchildxpchildxpchildxpchildxpchildxpchildxpchildxpchildxpchildxpchildxpchildxpchildxpchildxpchildxpchildxpchildxpchildxpchildxpchildxpchildxpchildxpchildxpchildxpchildxpchildxpchildxpchildxpchildxpchildxpchildxpchildxpchildxpchildxpchildxpchildxpchildxpchildxpchildxpchildxpchildxpchildxpchildxpchildxpchildxpchildxpchildxpchildxpchildxpchildxpchildxpchildxpchildxpchildxpchildxpchildxpchildxpchildxpchildxpchildxpchildxpchildxpchildxpchildxpchildxpchildxpchildxpchildxpchildxpchildxpchildxpchildxpchildxpchildxpchildxpchildxpchildxpchildxpchildxpchildxpchildxpchildxpchildxpchildxpchildxpchildxpchildxpchildxpchildxpchildxpchildxpchildxpchildxpchildxpchildxpchildxpchildxpchildxpchildxpchildxpchildxpchildxpchildxpchildxpchildxpchildxpchildxpchildxpchildxpchildxpchildxpchildxpchildxpchildxpchildxpchildxpchildxpchildxpchildxpchildxpchildxpchildxpchildxpchildxpchildxpchildxpchildxpchildxpchildxpchildxpchildxpchildxpchildxpchildxpchildxpchildxpchildxpchildxpchildxpchildxpchildxpchildxpchildxpchildxpchildxpchildxpchildxpchildxpchildxpchildxpchildxpchildxpchildxpchildxpchildxpchildxpchildxpchildxpchildxpchildxpchildxpchildxpchildxpchildxpchildxpchildxpchildxpchildxpchildxpchildxpchildxpchildxpchildxpchildxpchildxpchildxpchildxpchildxpchildxpchildxpchildxpchildxpchildxpchildxpchildxpchildxpchildxpchildxpchildxpchildxpchildxpchildxpchildxpchildxpchildxpchildxpchildxpchildxpchildxpchildxpchildxpchildxpchildxpchildxpchildxpchildxpchildxpchildxpchildxpchildxpchildxpchildxpchildxpchildxpchildxpchildxpchildxpchildxpchildxpchildxpchildxpchildxpchildxpchildxpchildxpchildxpchildxpchildxpchildxpchildxpchildxpchildxpchildxpchildxpchildxpchildxpchildxpchildxpchildxpchildxpchildxpchildxpchildxpchildxpchildxpchildxpchildxpchildxpchildxpchildxpchildxpchildxpchildxpchildxpchildxpchildxpchildxpchildxpchildxpchildxpchildxpchildxpchildxpchildxpchildxpchildxpchildxpchildxpchildxpchildxpchildxpchildxpchildxpchildxpchildxpchildxpchildxpchildxpchildxpchildxpchildxpchildxpchildxpchildxpchildxpchildxpchildxpchildxpchildxpchildxpchildxpchildxpchildxpchildxpchildxpchildxpchildxpchildxpchildxpchildxpchildxpchildxpchildxpchildxpchildxpchildxpchildxpchildxpchildxpchildxpchildxpchildxpchildxpchildxpchildxpchildxpchildxpchildxpchildxpchildxpchildxpchildxpchildxpchildxpchildxpchildxpchildxpchildxpchildxpchildxpchildxpchildxpchildxpchildxpchildxpchildxpchildxpchildxpchildxpchildxpchildxpchildxpchildxpchildxpchildxpchildxpchildxpchildxpchildxpchildxpchildxpchildxpchildxpchildxpchildxpchildxpchildxpchildxpchildxpchildxpchildxpchildxpchildxpchildxpchildxpchildxpchildxpchildxpchildxpchildxpchildxpchildxpchildxpchildxpchildxpchildxpchildxpchildxpchildxpchildxpchildxpchildxpchildxpchildxpchildxpchildxpchildxpchildxpchildxpchildxpchildxpchildxpchildxpchildxpchildxpchildxpchildxpchildxpchildxpchildxpchildxpchildxpchildxpchildxpchildxpchildxpchildxpchildxpchildxpchildxpchildxpchildxpchildxpchildxpchildxpchildxpchildxpchildxpchildxpchildxpchildxpchildxpchildxpchildxpchildxpchildxpchildxpchildxpchildxpchildxpchildxpchildxpchildxpchildxpchildxpchildxpchildxpchildxpchildxpchildxpchildxpchildxpchildxpchildxpchildxpchildxpchildxpchildxpchildxpchildxpchildxpchildxpchildxpchildxpchildxpchildxpchildxpchildxpchildxpchildxpchildxpchildxpchildxpchildxpchildxpchildxpchildxpchildxpchildxpchildxpchildxpchildxpchildxpchildxpchildxpchildxpchildxpchildxpchildxpchildxpchildxpchildxpchildxpchildxpchildxpchildxpchildxpchildxpchildxpchildxpchildxpchildxpchildxpchildxpchildxpchildxpchildxpchildxpchildxpchildxpchildxpchildxpchildxpchildxpchildxpchildxpchildxpchildxpchildxpchildxpchildxpchildxpchildxpchildxpchildxpchildxpchildxpchildxpchildxpchildxpchildxpchildxpchildxpchildxpchildxpchildxpchildxpchildxpchildxpchildxpchildxpchildxpchildxpchildxpchildxpchildxpchildxpchildxpchildxpchildxpchildxpchildxpchildxpchildxpchildxpchildxpchildxpchildxpchildxpchildxpchildxpchildxpchildxpchildxpchildxpchildxpchildxpchildxpchildxpchildxpchildxpchildxpchildxpchildxpchildxpchildxpchildxpchildxpchildxpchildxpchildxpchildxpchildxpchildxpchildxpchildxpchildxpchildxpchildxpchildxpchildxpchildxpchildxpchildxpchildxpchildxpchildxpchildxpchildxpchildxpchildxpchildxpchildxpchildxpchildxpchildxpchildxpchildxpchildxpchildxpchildxpchildxpchildxpchildxpchildxpchildxpchildxpchildxpchildxpchildxpchildxpchildxpchildxpchildxpchildxpchildxpchildxpchildxpchildxpchildxpchildxpchildxpchildxpchildxpchildxpchildxpchildxpchildxpchildxpchildxpchildxpchildxpchildxpchildxpchildxpchildxpchildxpchildxpchildxpchildxpchildxpchildxpchildxpchildxpchildxpchildxpchildxpchildxpchildxpchildxpchildxpchildxpchildxpchildxpchildxpchildxpchildxpchildxpchildxpchildxpchildxpchildxpchildxpchildxpchildxpchildxpchildxpchildxpchildxpchildxpchildxpchildxpchildxpchildxpchildxpchildxpchildxpchildxpchildxpchildxpchildxpchildxpchildxpchildxpchildxpchildxpchildxpchildxpchildxpchildxpchildxpchildxpchildxpchildxpchildxpchildxpchildxpchildxpchildxpchildxpchildxpchildxpchildxpchildxpchildxpchildxpchildxpchildxpchildxpchildxpchildxpchildxpchildxpchildxpchildxpchildxpchildxpchildxpchildxpchildxpchildxpchildxpchildxpchildxpchildxpchildxpchildxpchildxpchildxpchildxpchildxpchildxpchildxpchildxpchildxpchildxpchildxpchildxpchildxpchildxpchildxpchildxpchildxpchildxpchildxpchildxpchildxpchildxpchildxpchildxpchildxpchildxpchildxpchildxpchildxpchildxpchildxpchildxpchildxpchildxpchildxpchildxpchildxpchildxpchildxpchildxpchildxpchildxpchildxpchildxpchildxpchildxpchildxpchildxpchildxpchildxpchildxpchildxpchildxpchildxpchildxpchildxpchildxpchildxpchildxpchildxpchildxpchildxpchildxpchildxpchildxpchildxpchildxpchildxpchildxpchildxpchildxpchildxpchildxpchildxpchildxpchildxpchildxpchildxpchildxpchildxpchildxpchildxpchildxpchildxpchildxpchildxpchildxpchildxpchildxpchildxpchildxpchildxpchildxpchildxpchildxpchildxpchildxpchildxpchildxpchildxpchildxpchildxpchildxpchildxpchildxpchildxpchildxpchildxpchildxpchildxpchildxpchildxpchildxpchildxpchildxpchildxpchildxpchildxpchildxpchildxpchildxpchildxpchildxpchildxpchildxpchildxpchildxpchildxpchildxpchildxpchildxpchildxpchildxpchildxpchildxpchildxpchildxpchildxpchildxpchildxpchildxpchildxpchildxpchildxpchildxpchildxpchildxpchildxpchildxpchildxpchildxpchildxpchildxpchildxpchildxpchildxpchildxpchildxpchildxpchildxpchildxpchildxpchildxpchildxpchildxpchildxpchildxpchildxpchildxpchildxpchildxpchildxpchildxpchildxpchildxpchildxpchildxpchildxpchildxpchildxpchildxpchildxpchildxpchildxpchildxpchildxpchildxpchildxpchildxpchildxpchildxpchildxpchildxpchildxpchildxpchildxpchildxpchildxpchildxpchildxpchildxpchildxpchildxpchildxpchildxpchildxpchildxpchildxpchildxpchildxpchildxpchildxpchildxpchildxpchildxpchildxpchildxpchildxpchildxpchildxpchildxpchildxpchildxpchildxpchildxpchildxpchildxpchildxpchildxpchildxpchildxpchildxpchildxpchildxpchildxpchildxpchildxpchildxpchildxpchildxpchildxpchildxpchildxpchildxpchildxpchildxpchildxpchildxpchildxpchildxpchildxpchildxpchildxpchildxpchildxpchildxpchildxpchildxpchildxpchildxpchildxpchildxpchildxpchildxpchildxpchildxpchildxpchildxpchildxpchildxpchildxpchildxpchildxpchildxpchildxpchildxpchildxpchildxpchildxpchildxpchildxpchildxpchildxpchildxpchildxpchildxpchildxpchildxpchildxpchildxpchildxpchildxpchildxpchildxpchildxpchildxpchildxpchildxpchildxpchildxpchildxpchildxpchildxpchildxpchildxpchildxpchildxpchildxpchildxpchildxpchildxpchildxpchildxpchildxpchildxpchildxpchildxpchildxpchildxpchildxpchildxpchildxpchildxpchildxpchildxpchildxpchildxpchildxpchildxpchildxpchildxpchildxpchildxpchildxpchildxpchildxpchildxpchildxpchildxpchildxpchildxpchildxpchildxpchildxpchildxpchildxpchildxpchildxpchildxpchildxpchildxpchildxpchildxpchildxpchildxpchildxpchildxpchildxpchildxpchildxpchildxpchildxpchildxpchildxpchildxpchildxpchildxpchildxpchildxpchildxpchildxpchildxpchildxpchildxpchildxpchildxpchildxpchildxpchildxpchildxpchildxpchildxpchildxpchildxpchildxpchildxpchildxpchildxpchildxpchildxpchildxpchildxpchildxpchildxpchildxpchildxpchildxpchildxpchildxpchildxpchildxpchildxpchildxpchildxpchildxpchildxpchildxpchildxpchildxpchildxpchildxpchildxpchildxpchildxpchildxpchildxpchildxpchildxpchildxpchildxpchildxpchildxpchildxpchildxpchildxpchildxpchildxpchildxpchildxpchildxpchildxpchildxpchildxpchildxpchildxpchildxpchildxpchildxpchildxpchildxpchildxpchildxpchildxpchildxpchildxpchildxpchildxpchildxpchildxpchildxpchildxpchildxpchildxpchildxpchildxpchildxpchildxpchildxpchildxpchildxpchildxpchildxpchildxpchildxpchildxpchildxpchildxpchildxpchildxpchildxpchildxpchildxpchildxpchildxpchildxpchildxpchildxpchildxpchildxpchildxpchildxpchildxpchildxpchildxpchildxpchildxpchildxpchildxpchildxpchildxpchildxpchildxpchildxpchildxpchildxpchildxpchildxpchildxpchildxpchildxpchildxpchildxpchildxpchildxpchildxpchildxpchildxpchildxpchildxpchildxpchildxpchildxpchildxpchildxpchildxpchildxpchildxpchildxpchildxpchildxpchildxpchildxpchildxpchildxpchildxpchildxpchildxpchildxpchildxpchildxpchildxpchildxpchildxpchildxpchildxpchildxpchildxpchildxpchildxpchildxpchildxpchildxpchildxpchildxpchildxpchildxpchildxpchildxpchildxpchildxpchildxpchildxpchildxpchildxpchildxpchildxpchildxpchildxpchildxpchildxpchildxpchildxpchildxpchildxpchildxpchildxpchildxpchildxpchildxpchildxpchildxpchildxpchildxpchildxpchildxpchildxpchildxpchildxpchildxpchildxpchildxpchildxpchildxpchildxpchildxpchildxpchildxpchildxpchildxpchildxpchildxpchildxpchildxpchildxpchildxpchildxpchildxpchildxpchildxpchildxpchildxpchildxpchildxpchildxpchildxpchildxpchildxpchildxpchildxpchildxpchildxpchildxpchildxpchildxpchildxpchildxpchildxpchildxpchildxpchildxpchildxpchildxpchildxpchildxpchildxpchildxpchildxpchildxpchildxpchildxpchildxpchildxpchildxpchildxpchildxpchildxpchildxpchildxpchildxpchildxpchildxpchildxpchildxpchildxpchildxpchildxpchildxpchildxpchildxpchildxpchildxpchildxpchildxpchildxpchildxpchildxpchildxpchildxpchildxpchildxpchildxpchildxpchildxpchildxpchildxpchildxpchildxpchildxpchildxpchildxpchildxpchildxpchildxpchildxpchildxpchildxpchildxpchildxpchildxpchildxpchildxpchildxpchildxpchildxpchildxpchildxpchildxpchildxpchildxpchildxpchildxpchildxpchildxpchildxpchildxpchildxpchildxpchildxpchildxpchildxpchildxpchildxpchildxpchildxpchildxpchildxpchildxpchildxpchildxpchildxpchildxpchildxpchildxpchildxpchildxpchildxpchildxpchildxpchildxpchildxpchildxpchildxpchildxpchildxpchildxpchildxpchildxpchildxpchildxpchildxpchildxpchildxpchildxpchildxpchildxpchildxpchildxpchildxpchildxpchildxpchildxpchildxpchildxpchildxpchildxpchildxpchildxpchildxpchildxpchildxpchildxpchildxpchildxpchildxpchildxpchildxpchildxpchildxpchildxpchildxpchildxpchildxpchildxpchildxpchildxpchildxpchildxpchildxpchildxpchildxpchildxpchildxpchildxpchildxpchildxpchildxpchildxpchildxpchildxpchildxpchildxpchildxpchildxpchildxpchildxpchildxpchildxpchildxpchildxpchildxpchildxpchildxpchildxpchildxpchildxpchildxpchildxpchildxpchildxpchildxpchildxpchildxpchildxpchildxpchildxpchildxpchildxpchildxpchildxpchildxpchildxpchildxpchildxpchildxpchildxpchildxpchildxpchildxpchildxpchildxpchildxpchildxpchildxpchildxpchildxpchildxpchildxpchildxpchildxpchildxpchildxpchildxpchildxpchildxpchildxpchildxpchildxpchildxpchildxpchildxpchildxpchildxpchildxpchildxpchildxpchildxpchildxpchildxpchildxpchildxpchildxpchildxpchildxpchildxpchildxpchildxpchildxpchildxpchildxpchildxpchildxpchildxpchildxpchildxpchildxpchildxpchildxpchildxpchildxpchildxpchildxpchildxpchildxpchildxpchildxpchildxpchildxpchildxpchildxpchildxpchildxpchildxpchildxpchildxpchildxpchildxpchildxpchildxpchildxpchildxpchildxpchildxpchildxpchildxpchildxpchildxpchildxpchildxpchildxpchildxpchildxpchildxpchildxpchildxpchildxpchildxpchildxpchildxpchildxpchildxpchildxpchildxpchildxpchildxpchildxpchildxpchildxpchildxpchildxpchildxpchildxpchildxpchildxpchildxpchildxpchildxpchildxpchildxpchildxpchildxpchildxpchildxpchildxpchildxpchildxpchildxpchildxpchildxpchildxpchildxpchildxpchildxpchildxpchildxpchildxpchildxpchildxpchildxpchildxpchildxpchildxpchildxpchildxpchildxpchildxpchildxpchildxpchildxpchildxpchildxpchildxpchildxpchildxpchildxpchildxpchildxpchildxpchildxpchildxpchildxpchildxpchildxpchildxpchildxpchildxpchildxpchildxpchildxpchildxpchildxpchildxpchildxpchildxpchildxpchildxpchildxpchildxpchildxpchildxpchildxpchildxpchildxpchildxpchildxpchildxpchildxpchildxpchildxpchildxpchildxpchildxpchildxpchildxpchildxpchildxpchildxpchildxpchildxpchildxpchildxpchildxpchildxpchildxpchildxpchildxpchildxpchildxpchildxpchildxpchildxpchildxpchildxpchildxpchildxpchildxpchildxpchildxpchildxpchildxpchildxpchildxpchildxpchildxpchildxpchildxpchildxpchildxpchildxpchildxpchildxpchildxpchildxpchildxpchildxpchildxpchildxpchildxpchildxpchildxpchildxpchildxpchildxpchildxpchildxpchildxpchildxpchildxpchildxpchildxpchildxpchildxpchildxpchildxpchildxpchildxpchildxpchildxpchildxpchildxpchildxpchildxpchildxpchildxpchildxpchildxpchildxpchildxpchildxpchildxpchildxpchildxpchildxpchildxpchildxpchildxpchildx
###########################################
transport tablespace
###########################################
show create table test.t;
Table	Create Table
t	CREATE TABLE `t` (
  `col` varchar(200) DEFAULT 'xpchild',
  `col1` int(11) DEFAULT NULL,
  `col2` char(100) DEFAULT NULL,
  `col3` varchar(100) DEFAULT NULL,
  `col4` varchar(1000) DEFAULT NULL,
  `col5` int(11) DEFAULT NULL,
  `col6` int(11) DEFAULT NULL,
  `col7` text,
  KEY `ind` (`col`),
  KEY `ind_1` (`col1`),
  KEY `ind_2` (`col2`),
  KEY `ind_3` (`col3`),
  KEY `t_ind_4` (`col4`(767))
) ENGINE=InnoDB DEFAULT CHARSET=latin1 ROW_FORMAT=COMFORT
create database db_1;
use test;
flush table t for export;
use db_1;
create table t( col varchar(200) default 'xpchild',
col1 int,
col2 char(100),
col3 varchar(100),
col4 varchar(1000) DEFAULT NULL,
col5 int(11) DEFAULT NULL,
col6 int(11) DEFAULT NULL,
col7 text,
key ind(col),
key ind_1(col1),
key ind_2(col2),
key ind_3(col3),
KEY `t_ind_4` (`col4`(767))
)engine=innodb row_format=comfort;
set sql_log_bin=off;
alter table t discard tablespace;
alter table t import tablespace;
select count(*) from t;
count(*)
512
show create table t;
Table	Create Table
t	CREATE TABLE `t` (
  `col` varchar(200) DEFAULT 'xpchild',
  `col1` int(11) DEFAULT NULL,
  `col2` char(100) DEFAULT NULL,
  `col3` varchar(100) DEFAULT NULL,
  `col4` varchar(1000) DEFAULT NULL,
  `col5` int(11) DEFAULT NULL,
  `col6` int(11) DEFAULT NULL,
  `col7` text,
  KEY `ind` (`col`),
  KEY `ind_1` (`col1`),
  KEY `ind_2` (`col2`),
  KEY `ind_3` (`col3`),
  KEY `t_ind_4` (`col4`(767))
) ENGINE=InnoDB DEFAULT CHARSET=latin1 ROW_FORMAT=COMFORT
checksum table t;
Table	Checksum
db_1.t	405343375
use test;
unlock tables;
checksum table db_1.t;
Table	Checksum
db_1.t	405343375
checksum table test.t;
Table	Checksum
test.t	405343375
drop table db_1.t;
drop database db_1;
###########################################
online copy data operation
###########################################
alter table t drop index ind_1;
alter table t drop index ind_2;
alter table t drop index ind_3;
alter table t drop index t_ind_4;
alter table t drop column col3, drop column col4, drop column col5, drop column col6, drop column col7;
alter table t add col3 int default 10;
alter table t row_format=compact;
alter table t row_format=comfort;
alter table t add col4 int;
show create table t;
Table	Create Table
t	CREATE TABLE `t` (
  `col` varchar(200) DEFAULT 'xpchild',
  `col1` int(11) DEFAULT NULL,
  `col2` char(100) DEFAULT NULL,
  `col3` int(11) DEFAULT '10',
  `col4` int(11) DEFAULT NULL,
  KEY `ind` (`col`)
) ENGINE=InnoDB DEFAULT CHARSET=latin1 ROW_FORMAT=COMFORT
select count(*) from t;
count(*)
512
checksum table t;
Table	Checksum
test.t	3014549240
###########################################
online dml operation
###########################################
use test;
SET GLOBAL DEBUG='d,alter_table_sleep_for_online';
alter table t add col5 int;;
use test;
insert into t(col1, col2, col3, col4) select col1, col2, col3, col4 from t;
update t set col2=concat(col2, col) where col= 'xp1';
update t set col3=concat(col3, col) where col= 'xp2';
Warnings:
Warning	1265	Data truncated for column 'col3' at row 1
update t set col='xp3' where col= 'xp1';
select * from t where col='xp3';
col	col1	col2	col3	col4
xp3	2	xpxp1	10	NULL
delete from t where col='xp2';
commit;
use test;
SET GLOBAL DEBUG='';
show create table t;
Table	Create Table
t	CREATE TABLE `t` (
  `col` varchar(200) DEFAULT 'xpchild',
  `col1` int(11) DEFAULT NULL,
  `col2` char(100) DEFAULT NULL,
  `col3` int(11) DEFAULT '10',
  `col4` int(11) DEFAULT NULL,
  `col5` int(11) DEFAULT NULL,
  KEY `ind` (`col`)
) ENGINE=InnoDB DEFAULT CHARSET=latin1 ROW_FORMAT=COMFORT
select count(*)  from t;
count(*)
1023
checksum table t;
Table	Checksum
test.t	2353531991
insert into t(col, col1, col2, col3)  values('xp1', 2, 'xp', 'xpchild');
Warnings:
Warning	1366	Incorrect integer value: 'xpchild' for column 'col3' at row 1
insert into t(col, col1, col2, col3)  values('xp2', 2, 'xp', 'xpchild');
Warnings:
Warning	1366	Incorrect integer value: 'xpchild' for column 'col3' at row 1
commit;
###########################################
online copy data  and dml operation
###########################################
use test;
SET GLOBAL DEBUG='d,alter_table_sleep_for_online';
alter table t add col6 int default 100;;
use test;
insert into t(col1, col2, col3, col4) select col1, col2, col3, col4 from t;
update t set col2=concat(col2, col) where col ='xp1';
update t set col3=concat(col3, col) where col = 'xp2';
Warnings:
Warning	1265	Data truncated for column 'col3' at row 1
update t set col='xp3' where col='xp1';
select * from t where col='xp2';
col	col1	col2	col3	col4	col5
xp2	2	xp	0	NULL	NULL
delete from t where col='xp2';
commit;
use test;
SET GLOBAL DEBUG='';
show create table t;
Table	Create Table
t	CREATE TABLE `t` (
  `col` varchar(200) DEFAULT 'xpchild',
  `col1` int(11) DEFAULT NULL,
  `col2` char(100) DEFAULT NULL,
  `col3` int(11) DEFAULT '10',
  `col4` int(11) DEFAULT NULL,
  `col5` int(11) DEFAULT NULL,
  `col6` int(11) DEFAULT '100',
  KEY `ind` (`col`)
) ENGINE=InnoDB DEFAULT CHARSET=latin1 ROW_FORMAT=COMFORT
select count(*)  from t;
count(*)
2049
checksum table t;
Table	Checksum
test.t	3157771056
insert into t(col, col1, col2, col3)  values('xp1', 2, 'xp', 'xpchild');
Warnings:
Warning	1366	Incorrect integer value: 'xpchild' for column 'col3' at row 1
insert into t(col, col1, col2, col3)  values('xp2', 2, 'xp', 'xpchild');
Warnings:
Warning	1366	Incorrect integer value: 'xpchild' for column 'col3' at row 1
commit;
###########################################
online index data and dml operation
###########################################
use test;
SET GLOBAL DEBUG='d,alter_table_sleep_for_online';
alter table t add index ind_col4(col4);;
use test;
insert into t(col1, col2, col3, col4) select col1, col2, col3, col4 from t;
update t set col2=concat(col2, col) where col= 'xp1';
update t set col3=concat(col3, col) where col= 'xp2';
Warnings:
Warning	1265	Data truncated for column 'col3' at row 1
update t set col4=100 where col='xp2';
delete from t where col='xp2';
commit;
use test;
SET GLOBAL DEBUG='';
show create table t;
Table	Create Table
t	CREATE TABLE `t` (
  `col` varchar(200) DEFAULT 'xpchild',
  `col1` int(11) DEFAULT NULL,
  `col2` char(100) DEFAULT NULL,
  `col3` int(11) DEFAULT '10',
  `col4` int(11) DEFAULT NULL,
  `col5` int(11) DEFAULT NULL,
  `col6` int(11) DEFAULT '100',
  KEY `ind` (`col`),
  KEY `ind_col4` (`col4`)
) ENGINE=InnoDB DEFAULT CHARSET=latin1 ROW_FORMAT=COMFORT
select count(*)  from t;
count(*)
4101
checksum table t;
Table	Checksum
test.t	863417464
use test;
drop table t;
include/rpl_end.inc
