DROP TABLE IF EXISTS test.t1;
CREATE TABLE test.t1 (c1 INT, c2 INT);
INSERT INTO test.t1 (c1,c2) values (1,1),(2,2),(3,3),(4,4);
# Connection con1
LOCK TABLE test.t1 WRITE;
# Connection con2
SELECT * FROM test.t1 WHERE c1=4 FOR UPDATE NO_WAIT;
ERROR HY000: Lock wait timeout exceeded; try restarting transaction
SELECT * FROM test.t1 WHERE c1=4 FOR UPDATE WAIT 1;
ERROR HY000: Lock wait timeout exceeded; try restarting transaction
SELECT * FROM test.t1 WHERE c1=4 FOR UPDATE WAIT 31536001;
ERROR 42000: Variable 'wait_time' can't be set to the value of '31536001'
# Connection con1
INSERT INTO test.t1 VALUES(5,5);
UNLOCK TABLES;
set AUTOCOMMIT=0;
SELECT * FROM test.t1 WHERE c1=4 FOR UPDATE;
# Connection con2
set AUTOCOMMIT=0;
SET INNODB_LOCK_WAIT_TIMEOUT=1;
SELECT * FROM test.t1 WHERE c1=4 FOR UPDATE;
ERROR HY000: Lock wait timeout exceeded; try restarting transaction
SELECT * FROM test.t1 WHERE c1=4 FOR UPDATE NO_WAIT;
ERROR HY000: Lock wait timeout exceeded; try restarting transaction
SELECT * FROM test.t1 WHERE c1=4 FOR UPDATE WAIT 1;
ERROR HY000: Lock wait timeout exceeded; try restarting transaction
# Connection con1
UPDATE test.t1 SET c2=5 WHERE c1=4;
COMMIT;
set AUTOCOMMIT=0;
SELECT * FROM test.t1 WHERE c1=4 FOR UPDATE;
c1	c2
4	5
# Connection con2
set AUTOCOMMIT=0;
SET INNODB_LOCK_WAIT_TIMEOUT=1;
SELECT * FROM test.t1 WHERE c1=4 FOR UPDATE WAIT 10;
# Connection con1
COMMIT;
# Connection con2
DROP TABLE test.t1;
