include/master-slave.inc
Warnings:
Note	####	Sending passwords in plain text without SSL/TLS is extremely insecure.
Note	####	Storing MySQL user name or password information in the master info repository is not secure and is therefore not recommended. Please consider using the USER and PASSWORD connection options for START SLAVE; see the 'START SLAVE Syntax' in the MySQL Manual for more information.
[connection master]
create table t1(id int auto_increment, name varchar(30), key idx_id(id)) engine=innodb;
insert into t1(name) values('MySQL');
insert into t1(name) values('InnoDB');
insert into t1(name) select a.name from t1 a, t1 b;
insert into t1(name) select a.name from t1 a, t1 b;
insert into t1(name) select a.name from t1 a, t1 b;
delete from t1 where id > 1000 limit 100;
select variable_value = 100 from information_schema.global_status where variable_name='Innodb_rows_read';
variable_value = 100
1
alter table t1 alter index idx_id invisible;
delete from t1 where id > 1000 limit 100;
select table_name, index_name, is_visible from information_schema.statistics where index_name = 'idx_id';
table_name	index_name	is_visible
t1	idx_id	NO
select variable_value/100 > 100 from information_schema.global_status where variable_name='Innodb_rows_read';
variable_value/100 > 100
1
drop table t1;
include/rpl_end.inc
