drop table if exists t1;
create table t1 (a int);
insert into t1 values (1),(2);
set global rds_sql_select_filter= "+";
ERROR 42000: Variable 'rds_sql_select_filter' can't be set to the value of '+'
set global rds_sql_select_filter= "+,1";
ERROR 42000: Variable 'rds_sql_select_filter' can't be set to the value of '+,1'
set global rds_sql_select_filter= "+,1,";
ERROR 42000: Variable 'rds_sql_select_filter' can't be set to the value of '+,1,'
set global rds_sql_select_filter= "+,1,~";
ERROR 42000: Variable 'rds_sql_select_filter' can't be set to the value of '+,1,~'
set global rds_sql_select_filter= "+,0,a=1~";
ERROR 42000: Variable 'rds_sql_select_filter' can't be set to the value of '+,0,a=1~'
set global rds_sql_update_filter= "+";
ERROR 42000: Variable 'rds_sql_update_filter' can't be set to the value of '+'
set global rds_sql_update_filter= "+,1";
ERROR 42000: Variable 'rds_sql_update_filter' can't be set to the value of '+,1'
set global rds_sql_update_filter= "+,1,";
ERROR 42000: Variable 'rds_sql_update_filter' can't be set to the value of '+,1,'
set global rds_sql_update_filter= "+,1,~";
ERROR 42000: Variable 'rds_sql_update_filter' can't be set to the value of '+,1,~'
set global rds_sql_update_filter= "+,0,a=1~";
ERROR 42000: Variable 'rds_sql_update_filter' can't be set to the value of '+,0,a=1~'
set global rds_sql_delete_filter= "+";
ERROR 42000: Variable 'rds_sql_delete_filter' can't be set to the value of '+'
set global rds_sql_delete_filter= "+,1";
ERROR 42000: Variable 'rds_sql_delete_filter' can't be set to the value of '+,1'
set global rds_sql_delete_filter= "+,1,";
ERROR 42000: Variable 'rds_sql_delete_filter' can't be set to the value of '+,1,'
set global rds_sql_delete_filter= "+,1,~";
ERROR 42000: Variable 'rds_sql_delete_filter' can't be set to the value of '+,1,~'
set global rds_sql_delete_filter= "+,0,a=1~";
ERROR 42000: Variable 'rds_sql_delete_filter' can't be set to the value of '+,0,a=1~'
set global rds_sql_select_filter= "+,1,a=1~a=2";
show sql_filters;
type	item_id	cur_conc	max_conc	key_num	key_str
SELECT	1	0	1	2	+,1,a=1~a=2
select * from t1 where a=2 or a=1;
a
1
2
set global rds_sql_select_filter= "+,0,a=1~a=2";
set global rds_sql_delete_filter= "+,0,a=1";
set global rds_sql_update_filter= "+,0,a= 16~a= 1";
show variables like 'rds_sql_%_filter';
Variable_name	Value
rds_sql_delete_filter	+,0,a=1
rds_sql_select_filter	+,0,a=1~a=2
rds_sql_update_filter	+,0,a= 16~a= 1
select * from information_schema.sql_filter_info;
TYPE	ITEM_ID	CUR_CONC	MAX_CONC	KEY_NUM	KEY_STR
SELECT	2	0	0	2	+,0,a=1~a=2
SELECT	1	0	1	2	+,1,a=1~a=2
UPDATE	4	0	0	2	+,0,a= 16~a= 1
DELETE	3	0	0	1	+,0,a=1
select * from t1 where a=2 or a=1;
ERROR 70100: Query execution was interrupted
update t1 set a= 16 where a= 1;
ERROR 70100: Query execution was interrupted
delete from t1 where a=1;
ERROR 70100: Query execution was interrupted
set global rds_filter_key_cmp_in_order = 1;
select * from t1 where a=2 or a=1;
a
1
2
show sql_filters;
type	item_id	cur_conc	max_conc	key_num	key_str
SELECT	2	0	0	2	+,0,a=1~a=2
SELECT	1	0	1	2	+,1,a=1~a=2
UPDATE	4	0	0	2	+,0,a= 16~a= 1
DELETE	3	0	0	1	+,0,a=1
set global rds_sql_select_filter= "-,1,2";
show sql_filters;
type	item_id	cur_conc	max_conc	key_num	key_str
UPDATE	4	0	0	2	+,0,a= 16~a= 1
DELETE	3	0	0	1	+,0,a=1
create table t2 (a int);
set global rds_sql_update_filter= "+,0,t1~t2";
update t1 as a,t2 as b set b.a=1 where a.a = b.a;
ERROR 70100: Query execution was interrupted
update t2 as b,t1 as a set b.a=1 where a.a = b.a;
set global rds_sql_delete_filter= "+,0,t1~t2";
delete a from t1 as a,t2 as b where a.a = b.a;
ERROR 70100: Query execution was interrupted
delete a from t2 as b,t1 as a where a.a = b.a;
set global rds_reset_all_filter= 1;
set global rds_sql_select_filter= "+,0,a=1";
set global rds_sql_select_filter= "+,1,a=1";
select * from t1 where a=1;
a
1
set global rds_reset_all_filter= 1;
set global rds_sql_select_filter= "+,1,a=1";
set global rds_sql_select_filter= "+,0,a=1";
select * from t1 where a=1;
ERROR 70100: Query execution was interrupted
set global rds_reset_all_filter= 1;
set global rds_sql_select_filter= "+,1,a=1";
select * from t1 where sleep(1)=1 and a=1;
select * from information_schema.sql_filter_info;
TYPE	ITEM_ID	CUR_CONC	MAX_CONC	KEY_NUM	KEY_STR
SELECT	11	1	1	1	+,1,a=1
select * from t1 where a=1;
ERROR 70100: Query execution was interrupted
a
set global rds_reset_all_filter= 1;
set global rds_sql_update_filter= "+,1,a=1";
update t1 set a=2 where sleep(1)=1 and a=1;
select * from information_schema.sql_filter_info;
TYPE	ITEM_ID	CUR_CONC	MAX_CONC	KEY_NUM	KEY_STR
UPDATE	12	1	1	1	+,1,a=1
update t1 set a=1 where a=1;
ERROR 70100: Query execution was interrupted
set global rds_reset_all_filter= 1;
set global rds_sql_delete_filter= "+,1,a=1";
delete from t1 where sleep(1)=1 and a=1;
select * from information_schema.sql_filter_info;
TYPE	ITEM_ID	CUR_CONC	MAX_CONC	KEY_NUM	KEY_STR
DELETE	13	1	1	1	+,1,a=1
delete from t1 where a=2 and a=1;
ERROR 70100: Query execution was interrupted
grant usage on test.* to user1@localhost;
show sql_filters;
ERROR 42000: Access denied; you need (at least one of) the SUPER privilege(s) for this operation
drop user user1@localhost;
set global debug= "+d,sql_filter_fil_schema_error";
select * from information_schema.sql_filter_info;
ERROR HY000: Unknown error
set global debug= default;
set global rds_reset_all_filter= 0;
set global rds_sql_select_filter= concat('+,1,', repeat('a', 10241));
ERROR 42000: Variable 'rds_sql_select_filter' can't be set to the value of '+,1,aaaaaaaaaaaaaaaaaaaaaaaaaaaaaaaaaaaaaaaaaaaaaaaaaaaaaaaaaaaaaaaaaaaaaaaaaaaaaaaaaaaaaaaaaaaaaaaaaaaaaaaaaaaaaaaaaaaaaaaaaaaaaaaaaaaaaaaaaaaaaaaaaaaaaaaaaaaaaaaaaaaaaaaaaaaaaaaaaaaaaaaaaaaaaaaaaaaa'
set global rds_sql_select_filter= '+,a=1';
ERROR 42000: Variable 'rds_sql_select_filter' can't be set to the value of '+,a=1'
set global rds_sql_select_filter= '-,';
ERROR 42000: Variable 'rds_sql_select_filter' can't be set to the value of '-,'
set global rds_sql_select_filter= '-,a=1';
ERROR 42000: Variable 'rds_sql_select_filter' can't be set to the value of '-,a=1'
set global rds_sql_select_filter= '+,0,a=1';
show sql_filters;
type	item_id	cur_conc	max_conc	key_num	key_str
SELECT	14	0	0	1	+,0,a=1
DELETE	13	0	1	1	+,1,a=1
set global rds_sql_select_filter= '-,98,a=1';
ERROR 42000: Variable 'rds_sql_select_filter' can't be set to the value of '-,98,a=1'
set global rds_reset_all_filter= 1;
set global rds_sql_select_filter= '-,99';
set global debug= "+d,create_filter_item_error_0";
set global rds_sql_select_filter= '+,0,a=1';
ERROR HY000: Incorrect arguments to SET
show sql_filters;
type	item_id	cur_conc	max_conc	key_num	key_str
set global debug= default;
set global debug= "+d,create_filter_item_error_1";
set global rds_sql_select_filter= '+,0,a1~a2';
ERROR HY000: Incorrect arguments to SET
show sql_filters;
type	item_id	cur_conc	max_conc	key_num	key_str
set global debug= default;
set global debug= "+d,create_filter_item_error_2";
set global rds_sql_select_filter= '+,0,a1~a2';
ERROR HY000: Incorrect arguments to SET
show sql_filters;
type	item_id	cur_conc	max_conc	key_num	key_str
set global debug= default;
set global debug= "+d,add_filter_item_error_0";
set global rds_sql_select_filter= '+,0,a1~a2';
ERROR HY000: Incorrect arguments to SET
set global rds_sql_update_filter= '+,0,a1~a2';
ERROR HY000: Incorrect arguments to SET
set global rds_sql_delete_filter= '+,0,a1~a2';
ERROR HY000: Incorrect arguments to SET
show sql_filters;
type	item_id	cur_conc	max_conc	key_num	key_str
set global debug= default;
SET DEBUG_SYNC= 'find_matched_filter_and_update_after_get_cur_conc WAIT_FOR go';
set global rds_sql_select_filter= '+,2,a1a1';
show sql_filters;
type	item_id	cur_conc	max_conc	key_num	key_str
SELECT	20	0	2	1	+,2,a1a1
select 'a1a1';;
select 'a1a1' or sleep(2);;
show sql_filters;
type	item_id	cur_conc	max_conc	key_num	key_str
SELECT	20	1	2	1	+,2,a1a1
SET DEBUG_SYNC= 'now SIGNAL go';
a1a1
a1a1
show sql_filters;
type	item_id	cur_conc	max_conc	key_num	key_str
SELECT	20	1	2	1	+,2,a1a1
set global rds_reset_all_filter= 1;
'a1a1' or sleep(2)
0
Warnings:
Warning	1292	Truncated incorrect DOUBLE value: 'a1a1'
set global debug= "+d,check_lock_filter_list_sync";
set global rds_sql_select_filter= '+,2,a1a1';
show sql_filters;
type	item_id	cur_conc	max_conc	key_num	key_str
SELECT	21	0	2	1	+,2,a1a1
select 'a1a1';;
set @tbegin = unix_timestamp(now());
set global rds_sql_select_filter= '+,2,a2a2';
set @tend = unix_timestamp(now());
select @tend - @tbegin;
@tend - @tbegin
2
a1a1
a1a1
set global debug= default;
set global rds_sql_select_filter= '';
set global rds_sql_update_filter= '';
set global rds_sql_delete_filter= '';
set global rds_reset_all_filter= 1;
set global rds_filter_key_cmp_in_order = 0;
drop table t1;
drop table t2;
