set global rds_tablestat=on;
set global rds_indexstat=on;
create database test_1;
create table test_1.t1(
id int primary key auto_increment,
col1 varchar(100),
col2 int,
key(col2)
)engine= innodb;
create table test_1.t2(
id int primary key auto_increment,
col1 varchar(100),
col2 int,
key(col2)
)engine= myisam;
create temporary table test_1.t3(
id int primary key auto_increment,
col1 varchar(100),
col2 int,
key(col2)
)engine= innodb;
create temporary table test_1.t4(
id int primary key auto_increment,
col1 varchar(100),
col2 int,
key(col2)
)engine= myisam;
select count(*) from test_1.t1;
count(*)
200
select * from test_1.t1 where id=1;
id	col1	col2
1	test100	100
update test_1.t1 set col1='update' where id=1;
delete from test_1.t1 where id=1;
commit;
select count(col2) from test_1.t2;
count(col2)
200
select count(col2) from test_1.t3;
count(col2)
100
select count(col2) from test_1.t4;
count(col2)
100
select * from information_schema.table_statistics order by table_schema, table_name;
TABLE_SCHEMA	TABLE_NAME	ROWS_READ	ROWS_CHANGED	ROWS_CHANGED_X_INDEXES	ROWS_INSERTED	ROWS_DELETED	ROWS_UPDATED
test_1	t1	303	202	404	200	1	1
test_1	t2	300	200	400	200	0	0
test_1	t3	100	100	200	100	0	0
test_1	t4	100	100	200	100	0	0
select * from information_schema.index_statistics order by table_schema, table_name, index_name;
TABLE_SCHEMA	TABLE_NAME	INDEX_NAME	ROWS_READ
test_1	t1	col2	200
test_1	t1	PRIMARY	103
test_1	t2	col2	200
test_1	t3	col2	100
test_1	t4	col2	100
create table test_1.xxx(id int primary key, name varchar(20)) engine=myisam;
insert into test_1.xxx values(10, 'a');
insert into test_1.xxx values(9, 'a');
insert into test_1.xxx values(8, 'a');
insert into test_1.xxx values(7, 'a');
insert into test_1.xxx values(6, 'a');
insert into test_1.xxx values(5, 'a');
insert into test_1.xxx values(4, 'a');
insert into test_1.xxx values(3, 'a');
insert into test_1.xxx values(2, 'a');
insert into test_1.xxx values(1, 'a');
delete from test_1.xxx where id= 1;
delete from test_1.xxx where id in (1,2,5);
delete from test_1.xxx where id > 9;
select * from test_1.xxx;
id	name
9	a
8	a
7	a
6	a
4	a
3	a
set global rds_tablestat=off;
set global rds_indexstat=off;
drop table test_1.t1;
drop table test_1.t2;
drop table test_1.xxx;
drop database test_1;
