drop table if exists t1;
create table t1 (id int primary key, c int) engine=innodb;
update TARGET_AFFECT_ROW 1 t1 set c=c+1 where id=1;
ERROR HY000: The affected row number does not match that of user specified.
begin;
insert into t1 values(1,1);
update COMMIT_ON_SUCCESS ROLLBACK_ON_FAIL TARGET_AFFECT_ROW 1 t1 set c=c+1 where id=1;
select * from t1;
id	c
1	2
begin;
insert into t1 values(2,1);
update COMMIT_ON_SUCCESS ROLLBACK_ON_FAIL TARGET_AFFECT_ROW 2 t1 set c=c+1 where id=2;
ERROR HY000: The affected row number does not match that of user specified.
select * from t1;
id	c
1	2
set @a=3;
start transaction;
insert into t1 values(3,1);
prepare stmt from "update COMMIT_ON_SUCCESS ROLLBACK_ON_FAIL TARGET_AFFECT_ROW 1 t1 set c=c+1 where id=?";
execute stmt using @a;
prepare stmt from "insert COMMIT_ON_SUCCESS ROLLBACK_ON_FAIL into t1 values(?,1)";
execute stmt using @a;
ERROR 23000: Duplicate entry '3' for key 'PRIMARY'
select * from t1;
id	c
1	2
3	2
update COMMIT_ON_SUCCESS ROLLBACK_ON_FAIL QUEUE_ON_PK 1 TARGET_AFFECT_ROW 1 t1 set c=c+1 where id=1;
select * from t1;
id	c
1	3
3	2
set global rds_ic_reduce_hint_enable=OFF;
insert QUEUE_ON_PK 2 into t1 values(4,sleep(2));;
set @tbegin=unix_timestamp(now());
insert QUEUE_ON_PK 2 into t1 values(5,sleep(2));
set @tend=unix_timestamp(now());
select @tend - @tbegin cost;
cost
2
delete from t1 where id in (4,5);
set global rds_ic_reduce_hint_enable=ON;
insert QUEUE_ON_PK 2 into t1 values(4,sleep(2));;
set @tbegin=unix_timestamp(now());
insert QUEUE_ON_PK 2 into t1 values(5,sleep(2));
set @tend=unix_timestamp(now());
select @tend - @tbegin cost;
cost
4
begin;
insert QUEUE_ON_PK 2 into t1 values(6,1);
insert QUEUE_ON_PK 2 into t1 values(7,1);
commit;
insert COMMIT_ON_SUCCESS ROLLBACK_ON_FAIL into t1 values(7,1);
ERROR 23000: Duplicate entry '7' for key 'PRIMARY'
insert COMMIT_ON_SUCCESS ROLLBACK_ON_FAIL into t1 values(8,1);
create table t2 like t1;
insert into t2 value (1,1),(2,2);
update COMMIT_ON_SUCCESS ROLLBACK_ON_FAIL t1,t2 set t2.c=3 where t2.id=t1.id and t1.id=1;
update COMMIT_ON_SUCCESS ROLLBACK_ON_FAIL t1,t2 set t2.id=2 where t2.id=t1.id and t1.id=1;
ERROR 23000: Duplicate entry '2' for key 'PRIMARY'
SET DEBUG_SYNC='after_unlock_queue_lock_in_unregist WAIT_FOR unlock_in_check';
insert QUEUE_ON_PK 2 into t1 values(9,1);;
SET DEBUG_SYNC='after_unlock_queue_lock_in_check SIGNAL unlock_in_check WAIT_FOR go';
insert QUEUE_ON_PK 2 into t1 values(10,1);;
SET DEBUG_SYNC='now SIGNAL go';
set global rds_ic_reduce_hint_enable=OFF;
drop table t1,t2;
