drop table if exists t;
create table t(id int auto_increment primary key, a int)engine=innodb;
insert into t(a) values(1),(2),(3),(4);
grant select,insert,update,delete on test.* to tr_test@localhost;
flush privileges;
set @lock_wait_timeout=@@global.innodb_lock_wait_timeout;
set global innodb_lock_wait_timeout=1;
set @tr_high_watermark=@@global.rds_threads_running_high_watermark;
set @tr_ctl_mode=@@global.rds_threads_running_ctl_mode;
show global variables like 'rds_threads_running_ctl_mode';
Variable_name	Value
rds_threads_running_ctl_mode	SELECTS
set global rds_threads_running_high_watermark=0;
show global variables like 'rds_threads_running_high_watermark';
Variable_name	Value
rds_threads_running_high_watermark	151
show global variables like 'max_connections';
Variable_name	Value
max_connections	151
begin;
select * from t;
id	a
1	1
2	2
3	3
4	4
begin;
select sleep(100);
select sleep(100);
select sleep(100);
select sleep(100);
select sleep(100);
select sleep(100);
select sleep(100);
select sleep(100);
show status like 'Threads_rejected';
Variable_name	Value
Threads_rejected	0
set global rds_threads_running_ctl_mode=DEFAULT;
set global rds_threads_running_high_watermark=8;
show global variables like 'rds_threads_running_high_watermark';
Variable_name	Value
rds_threads_running_high_watermark	8
show global variables like 'rds_threads_running_ctl_mode';
Variable_name	Value
rds_threads_running_ctl_mode	SELECTS
select * from t;
ERROR HY000: MySQL Sever is too busy.
insert into t values(5,5);
update t set a=10 where id=5;
delete from t where id=5;
commit;
rollback;
show status like 'Threads_rejected';
Variable_name	Value
Threads_rejected	1
select * from t;
id	a
1	1
2	2
3	3
4	4
#For SELECT...FROM UPDATE...(rds_threads_running_ctl_mode=DEFAULT)
show status like 'Threads_running';
Variable_name	Value
Threads_running	9
select * from t;
ERROR HY000: MySQL Sever is too busy.
update t set a=a+1 where id=1;
show status like 'Threads_rejected';
Variable_name	Value
Threads_rejected	2
commit;
insert into t values (5,5);
update t set a=10 where id=5;
delete from t where id=5;
select * from t;
ERROR HY000: MySQL Sever is too busy.
show status like 'Threads_rejected';
Variable_name	Value
Threads_rejected	3
set global rds_threads_running_ctl_mode=ALL;
show global variables like 'rds_threads_running_ctl_mode';
Variable_name	Value
rds_threads_running_ctl_mode	ALL
select * from t;
ERROR HY000: MySQL Sever is too busy.
insert into t values(7,7);
ERROR HY000: MySQL Sever is too busy.
update t set a=14 where id=7;
ERROR HY000: MySQL Sever is too busy.
delete from t where id=7;
ERROR HY000: MySQL Sever is too busy.
commit;
rollback;
show status like 'Threads_rejected';
Variable_name	Value
Threads_rejected	7
#For SELECT...FROM UPDATE...(rds_threads_running_ctl_mode=ALL)
update t set a=a+1 where id=1;
ERROR HY000: MySQL Sever is too busy.
show status like 'Threads_rejected';
Variable_name	Value
Threads_rejected	8
select * from t;
id	a
1	1
2	2
3	3
4	4
insert into t values (9,9);
update t set a=18 where id=9;
delete from t where id=9;
commit;
select * from t;
ERROR HY000: MySQL Sever is too busy.
insert into t values (10,10);
ERROR HY000: MySQL Sever is too busy.
update t set a=20 where id=10;
ERROR HY000: MySQL Sever is too busy.
delete from t where id=10;
ERROR HY000: MySQL Sever is too busy.
commit;
show status like 'Threads_rejected';
Variable_name	Value
Threads_rejected	12
kill query ID;
kill query ID;
kill query ID;
kill query ID;
kill query ID;
kill query ID;
kill query ID;
set global rds_threads_running_high_watermark=1;
set global debug= "+d,thread_running_change_before_doublecheck";
select * from t;;
kill query ID;
id	a
1	2
2	2
3	3
4	4
set global rds_threads_running_high_watermark=8;
set global debug= default;
sleep(100)
1
show global variables like 'rds_threads_running_%';
Variable_name	Value
rds_threads_running_ctl_mode	ALL
rds_threads_running_high_watermark	8
show global variables like 'rds_threads_running_%';
Variable_name	Value
rds_threads_running_ctl_mode	ALL
rds_threads_running_high_watermark	8
sleep(100)
1
sleep(100)
1
sleep(100)
1
sleep(100)
1
sleep(100)
1
sleep(100)
1
sleep(100)
1
set global rds_threads_running_high_watermark=@tr_high_watermark;
set global rds_threads_running_ctl_mode=@tr_ctl_mode;
set global innodb_lock_wait_timeout=@lock_wait_timeout;
drop user tr_test@localhost;
drop table t;
